 ,INDONESIA LIMITS OIL PRICE IMPACTFINANCE MINISTER ,WOOLWORTH BIDS 244 MLN STG FOR SUPERDRUG ,JAPAN HAS LITTLE NEW TO OFFER IN MICROCHIP DISPUTE ,HK DEALERS SAY NAKASONE G6 COMMENT TOO LATE ,JAPANESE KEEN TO ENTER GERMAN PRIMARY BOND MARKET ,NORTH KOREA AGREES TO TOP LEVEL TALKS WITH SOUTH ,ARBED SA ltARBBBR> YEAR 1986 ,TOKYO STOCK EXCHANGE CUTS TRADING HOURS ,JAPAN ACTIVELY BOUGHT US CORN LAST WEEK  TRADE ,ARBED SEES NEED TO MAINTAIN PRESSURE ON COSTS ,BASF ltBASFF> SAYS 1986 RESULTS AFFECTED BY DLR ,BAHRAIN INTRODUCES NEW MONEY MARKET REGIME ,JAPAN BUYS LARGE AMOUNT OF BRAZILIAN SOYBEANS ,WESTPAC CALLS FOR CUT IN AUSTRALIAN BUDGET DEFICIT ,DUTCH MONEY SUPPLY HARDLY CHANGED IN DECEMBER ,SINGAPORE WELCOMES NEW LME ALUMINIUM CONTRACT MOVE ,BANK OF ENGLAND FORECASTS SURPLUS IN MONEY MARKET ,BANK OF JAPAN TO SELL 500 BILLION YEN IN BILLS ,PHILIPPINE COCONUT AGENCY GETS NEW ADMINISTRATOR ,TESCO BUYS 54 PCT OF HILLARDS ,ROYALE BELGE ltRBVBBR> YEAR 1986 ,SRI LANKAN MINISTER SEEKS LOAN FACILITY FROM IMF ,JAPANESE SHIPYARDS TO FORM CARTEL CUT OUTPUT ,INDONESIAN RUPIAH SLIPS AGAINST MARK AND YEN ,GILLETTE CANADA ISSUES 500 MLN FRENCH FRANC BOND ,PHILIPPINE COCONUT INDUSTRY WORRIED BY EC TAX ,WALLENBERG GROUP RAISES STAKE IN ERICSSON ,GKN REORGANISES JOINT VENTURE ,YUGOSLAVIA TO HELP PRODUCE NEW SOVIET AIRLINER ,FRENCH FEBRUARY INFLATION CONFIRMED AT 02 PCT ,PHILIPPINE DEBT PACT SEEN AS GOOD FOR ECONOMY ,TORAY INDUSTRIES NAMES NEW PRESIDENT ,UAE CENTRAL BANK CD YIELDS HIGHER ,CREDIT AGRICOLE OFFERS TO SWAP BONDS ,SRI LANKA TO UPROOT OR BUD DISEASED RUBBER TREES ,KANSALLISOSAKEPANKKI LAUNCHES 100 MLN DLR BONDS , Miyazawa expects dollar to rebound soon spokesman says
 ,QUEBECOR ISSUES 60 MLN DLR CONVERTIBLE BOND ,ONGPIN SAYS "PINS" WILL REVIVE BAKER PLAN ,PHILADELPHIA EXCHANGE TO EXTEND HOURS FOR ASIA ,YIELD FALLS ON 91DAY SAMA DEPOSITS ,MIYAZAWA EXPECTS DOLLAR REBOUND SOON  SPOKESMAN ,UK CONFIRMS FEBRUARY STERLING M3 RISE ,SLOUGH ESTATES VIEWS 1987 PROSPECTS CONFIDENTLY ,GERMAN FEBRUARY WHOLESALE TURNOVER RISES ONE PCT ,NISSAN MEXICANA TO TAKE OVER CAR ENGINE EXPORTS ,GERMAN CALL MONEY RISES ON PENSION PAYMENTS ,EC COMMISSIONER WELCOMES COCOA ACCORD ,RUGBY WELL PREPARED FOR NEW CEMENT COMPETITION ,MANNESMANN BUYS INDIRECT MAJORITY STAKE IN SACHS ,CHINESE CHEMICAL PLANT TO ISSUE DOMESTIC BOND ,SINGAPORE M1 MONEY SUPPLY 27 PCT UP IN JANUARY ,BROWN BOVERI WINS SUPERCHARGER ORDER FROM MAZDA ,B AND C REORGANISES COMMERCIAL OPERATIONS ,JAPAN CONDUCTS CURRENCY SURVEY OF BIG INVESTORS ,BP UK REFINERY DUE TO PARTLY REOPEN NEXT WEEK ,NO INTERVENTION DOLLAR FIXED AT 18063 MARKS ,TOP QUALITIES SOUGHT ON HAMBURG COFFEE MARKET ,CERTAINTEED SEEKS 150 MLN DLR CREDIT FACILITY ,SINGAPORE BANK CREDIT RISES IN JANUARY ,BANK OF ENGLAND DOES NOT OPERATE IN MONEY MARKET ,ASIAN DOLLAR MARKET ASSETS FALL IN JANUARY ,HK M3 MONEY SUPPLY RISES 14 PCT IN FEBRUARY ,ALGERIA SETS TENDER FOR RAPE/SUNFLOWERSEED OIL ,ICN MARK EUROBOND ISSUE NOW UNCERTAIN ,COCOA DEAL SEEN POSITIVE BUT NO PRICE GUARANTEE ,JAPAN WANTS GOVERNMENTS TO BUY ITS TBILLS ,G6 WANTS TO HOLD DLR ABOVE 150 YEN  NAKASONE ,GILLETTE CANADA ISSUES 500 MLN FRENCH FRANC BOND ,QUEBECOR ISSUES 60 MLN DLR CONVERTIBLE BOND ,GERMAN BANKS OUTLOOK CLOUDIER AFTER RECORD 1986 ,MIYAZAWA EXPECTS DOLLAR REBOUND SOON  SPOKESMAN ,NAKASONE SOUNDS CONCILIATORY NOTE IN CHIP DISPUTE ,AMYLUM CHAIRMAN DISAPPOINTED BY FERRUZZICPC DEAL ,SUMITA SAYS HE DOES NOT EXPECT FURTHER DOLLAR FALL ,DLR FALLS ON FEARS MIYAZAWA SAYS ,JAPAN ISOLATED YEN RISES WORLD FEELS CHEATED ,ALITALIA PILOTS START WEEK OF INDUSTRIAL ACTION ,PHILADELPHIA EXCHANGE TO EXTEND HOURS FOR ASIA ,JAPAN CAREFULLY CONSIDERING MONEY POLICY  SUMITA ,YUGOSLAVIA SHARPLY INCREASES SAVINGS RATES ,US BUDGET DIRECTOR SAYS NO TAX HIKE COMPROMISE ,CITROEN PLANS TO CLOSE LEVALLOIS PLANT ,DUTCH BONDS SEEN RALLYING FURTHER THIS WEEK ,TOKYO BIDS TO STOP CHIP ROW BECOMING TRADE WAR ,US APPEARS TO TOLERATE FURTHER DLR DECLINE ,BALDRIGE PREDICTS END OF USJAPAN TRADE DISPUTE ,US BANKER PREDICTS FURTHER DOLLAR FALL THIS YEAR ,CALIFORNIA THRIFT CLOSED DEPOSITS TRANSFERED ,INVESTOR GROUP PUTS PRESSURE ON GENCORP ltGY> ,RENAULT PLANS JOB CUTS AT BOULOGNE PLANT ,UNITED BANKS COLORADO ltUBKS> ACQUISITION CLEARED ,SUFFIELDS ltSSBK> COASTAL ltCSBK> BUY CLEARED ,MARKETING SYSTEMS ltMASY> SEEKS ACQUISITIONS ,CHANTAL PHARMACEUTICAL ltCHTL> SHARES TO BE SOLD ,ORACLE SYSTEMS ltORCL> FILES FOR OFFERING ,YORK RESEARCH ltYORK> GETS EQUITY FINANCING ,POTOMAC ELECTRIC ltPOM> PREFERRED SOLD ,AMVESTORS ltAVFC> FILES FOR SHARE OFFERING ,SKANSKA TO TAKE STAKE IN CANADIAN FIRM ,BRITISH GAS REPAYS 750 MLN STG DEBT ,UK MONEY MARKET GIVEN 129 MLN STG ASSISTANCE ,GREECE SCRAPS US BASE CLOSURE REQUEST ,WORKERS TO END 4DAY STRIKE AT GENERAL MOTORS ,ONGPIN SAYS "PINS" WILL REVIVE BAKER PLAN ,EC MINISTERS STUDY FARM PRICES NO ACCORD SEEN ,DOMINION RESOURCES ltD> SEEKS RATE HIKE ,WEDGESTONE REALTY ltWDG> ISSUES WARRANTS ,PANAMA SUGAR VESSEL SAFELY DOCKED AT GREENOCK ,JAPAN SET TO RIDE OUT YEN RISE OFFICIALS SAY ,SAGE ANALYTICS ltSAII> SETS STOCK SPLIT ,US BUDGET DIRECTOR SAYS NO TAX RISE COMPROMISE ,HK DEALERS SAY NAKASONE G6 COMMENT TOO LATE ,JAPAN CONDUCTS CURRENCY SURVEY OF BIG INVESTORS ,JAPANESE SEEN LIGHTENING US BOND HOLDINGS ,IDEC IZUMI ISSUES 35 MLN DLR EQUITY WARRANT BOND ,PERU ANNOUNCES LARGE NEW GOLD FIND ,BRITISH GAS REPAYS 750 MLN STG DEBT ,MAGMA POWER ltMGMA> NAMES NEW CHIEF EXECUTIVE ,FRENCH 13WEEK TBILL AVERAGE RATE FALLS TO 735 PCT FROM 737 PCT  OFFICIAL
 ,NEWS CORP LTD TO ACQUIRE HARPER AND ROW PUBLISHERS INC FOR 65 DLRS/SHARE
 ,CANADIAN WORLDWIDE ENERGY BUYS TRITONltOIL> UNIT ,CLABIR ltCLG> DIVIDENDS NOT TAXABLE ,RLI CORP ltRLI> TO BEGIN TRADING ON THE NYSE ,TEXSCAN HAS TENTATIVE REORGANIZATION PLAN ,MICROMEMBRANES ltMEMB> LAUNCHES SECOND PRODUCT ,PHILIPPINES WORLD BANK SIGN 310 MLN DLR PACKAGE ,LENNAR ltLEN> SEES STRONG EARNINGS FOR 1987 YEAR ,FORD MOTOR CREDIT UNIT FILES FOR TWO BILLION DLR DEBT SHELF OFFERING
 ,NASD STARTS SEARCH FOR NEW PRESIDENT ,YUGOSLAV TRADE FALLS SHARPLY  STATISTICS SHOW ,WALBRO ltWALB> SEES STRONG 1ST QTR RESULTS ,CANADA GDP UP 01 PCT IN JANUARY ,TECHNOLOGY/IBMS NEW COMPUTER NERVOUSLY AWAITED ,SRI LANKA APPEALS FOR DROUGHT RELIEF AID ,MOBIL FRANCE TO TAKE 10 PCT STAKE IN PRIMAGAZ ,METROMAIL ltMTML> SEES FLAT YEAR NET ,REGENCY CRUISTS ltSHIP> CORRECTS EARNINGS ,MORRISON INC ltMORR> ACQUIRES CUSTOM MANAGEMENT ,CHINA WINS CYPRUS IRRIGATION CONTRACT ,PETER MILLER PLANS 22 MLN DLR DEBENTURE ISSUE ,NYNEXS NEW YORK TELEPHONE FILES 500 MLN DLR DEBT SECURITIES SHELF REGISTRATION
 ,GTE ltGTE> UNIT INDIANA NATL ltINAT> SIGN PACT ,ANECO REINSURANCE CO LTD ltANECF> YEAR NET ,TEXAS INTERNATIONAL CO ltTEI> 4TH QTR LOSS ,SCIENTIFIC MICRO ltSMSI> SEES HIGHER REVENUES ,NYNEX ltNYN> UNIT FILES TO OFFER DEBT SECUTITIES ,BOLT BERANEK ltBBN> FILES FOR DEBENTURE OFFERING ,HENLEY GROUP SAID HAS CLOSE TO FIVE PCT OR 79 MLN SHARES OF SANTA FE SOUTHERN PACIFIC AS INVESTMENT
 ,MEXICAN FIRST QTR CRUDE EXPORTS SEEN AT 1525 DLRS ,LONDON STOCK EXCHANGE REVISES FTSE CONSTITUENTS ,TEXAS INTERNATIONAL ltTEI> HAS UNQUALIFIED AUDIT ,TENNECO ltTGT> BUYS UNISYS ltUIS> UNIT ,BIOGEN ltBGENF> MAY SELL EUROPEAN OPERATIONS ,TEXSCAN REACHES REORGANIZATION AGREEMENT ,MILTOPE GROUP INC ltMILT> 4TH QTR NET ,SPECTRUM CONCEPTS UNVEILS NETWORKING PRODUCT ,ALOETTE COSMETICS INC ltALET> 4TH QTR DEC 31 NET ,TRADE BODY SETS NEW RULES FOR EURODOLLAR MANAGERS ,INTERNATIONAL PROTEINS CORP ltPRO> YEAR NET ,CSM SYSTEMS INC ltCSMS> YEAR ENDED DEC 31 LOSS ,IaSo Minn direct hogs estimated rcpts 95000 vs actual week ago 93000 and actual year ago 93000
 ,BAXTER ltBAX> STARTS CLINICAL TRIALS ON DRUG ,FED SETS TWO BILLION DLR CUSTOMER REPURCHASE FED SAYS
 ,GLOBAL RAISES HEAVY FUELS PRICES ,LONDONS FTSE 100 FALLS BY LARGEST EVER MARGIN ,TURKISH PREMIER HINTS AT AEGEAN TALKS ,UK GOVERNMENT BONDS PLUMMET WITH US ISSUES ,FED ADDS RESERVES VIA CUSTOMER REPURCHASES ,CENTRONICS ltCEN> CHAIRMAN RESIGNS ,PHILADELPHIA EXCHANGE SETS FAR EAST MARKETING ,BOW VALLEY INDUSTRIESltBVI> SETS SECONDARY ISSUE ,ltCORNUCOPIA RESOURCES LTD> IN DRILLING PROGRAM ,WESTINGHOUSE ltWX> TO MOVE POWER GENERATION UNIT ,COGNITRONICS CORP ltCGN> 4TH QTR LOSS ,ALLEGHENY INTERNATIONAL SELLS WILKINSON SWORD GROUP FOR 230 MLN DLRS
 ,HENLEY ltHENG> HAS SANTA FE SOUTHERN ltSFX> STAKE ,MEXICAN FIRST QTR CRUDE EXPORTS SEEN AT 1525 DLRS ,COMBUSTION ltCSP> COMPLETES ACCURAY ltACRA> BUY ,REYNOLDS AND REYNOLDS SUED FOR THEFT OF SECRETS ,US SEES NO NEW COFFEE AGREEMENT TALKS SOON ,INTELLIGENT SYSTEMS ltINP> SETS INITIAL PAYOUT ,GREAT COUNTRY BANK ltGCBK> EXECUTIVE RESIGNS ,QUEST MEDICAL INC ltQMED> 4TH QTR LOSS ,CREDITANSTALT ARRANGES 100 MLN STG CD PROGRAM ,MOODYS MAY DOWNGRADE GOTABANKEN AND UNIT AFFECTS 22 BILLION CROWNS OF DEBT
 ,TRADE SEES US CORN EXPORTS UP WHEAT/BEANS OFF ,OPPENHEIMER HAS SIX PCT OF CYCLOPS ltCYL> ,DUNE RESOURCES LTD ltDNLAF> 4TH QTR NET ,AW COMPUTER SYSTEMS INC ltAWCSA> YEAR END DEC 31 ,DOWltDOW> RAISES STYRENEBUTADIENE LATEX PRICES ,ALLEGHENY INTERNATIONAL ltAG> SELLS WILKINSON ,ELDE ELECTRO ltELOPF> OFFERING SELLS OUT ,GOTABANKEN AND UNIT MAY BE DOWNGRADED BY MOODYS ,PUNTA GORDA ISLES ltPGI> SELLS PREFERRED STOCK ,DATRON CORP ltDATR> 4TH QTR NET ,COMB ltCMCO> SELLS THREE RETAIL STORES ,CENTRONICS ltCEN> SETS PREFERRED PURCHASE RIGHTS ,MCCLAIN INDUSTRIES ltMCCL> SETS STOCK SPLIT ,HERITAGE COMMUNICATIONS ltHCI> IN SPECIAL MEETING ,WESTAR ltWSTR> IN NEGOTIATIONS WITH NORANDA ,CHEROKEE GROUP INC ltCHKE> 1ST QTR FEB 28 NET ,VITRAMON ltVITR> TO FILE FOR SHARE OFFERING ,LOUISIANA PACIFIC ltLPX> TO BUY WALLBOARD PLANT ,NYSE SAYS SANTA FE ltSFX> NO RESPONSE YET ON STOCK ,NOBELS BOFORS TO SELL ITS SINGAPORE HOLDING ,ICO BOARD SEEN UNLIKELY TO SET NEW COFFEE TALKS ,MINISTER SEES ENOUGH EC STATES AGAINST OILS TAX ,DRAVO ltDRV> TO HAVE FIRST QUARTER LOSS ,ECONOMIC SPOTLIGHT  US CONGRESS RAPS JAPAN ,MIDLAND SETS UP SUBSIDIARY IN FINLAND ,GENERAL PUBLIC UTILITIES CORP ltGPU> TWO MTHS NET ,KAUFMAN BOARD ltKB> UNITS CUT QUAKER ltKSF> STAKE ,BUSINESSMAN HAS 57 PCT OF ARDEN GROUP ltARDNA> ,TURKEY GREECE MOVING TOWARDS AEGEAN TALKS  OZAL ,SENATE BILL WOULD ALLOW FARM LOAN WRITEDOWNS ,ITALYS CIR PLANS CONVERTIBLE BOND ISSUES ,FED WILL BUY BILLS FOR CUSTOMER AFTER AUCTION ,CHIRAC SAYS 1988 BUDGET DEFICIT WILL BE LOWER ,NYSE SAYS SANTA FE ltSFX> DECLINES COMMENT ,GM ltGM> SAID TO CUT 2ND QTR OUTPUT SCHEDULES ,METROMAIL CORP ltMTML> 3RD QTR MARCH 1 NET ,ORANGE ltOJAY> IN DEFINITIVE PACT TO SELL UNITS ,SIERRACIN CORP ltSER> 4TH QTR NET ,NIGERIA TO ISSUE 15 BILLION DLRS IN PROMISSORY NOTES APRIL 7 FOR UNINSURED TRADE DEBT  TRUSTEE
 ,COMPUTER MICROFILM CORP ltCOMI> YEAR NET ,COMPUTER MICROFILM ltCOMI> SEES HIGHER 1987 NET ,KEVLIN MICROWAVE CORP ltKVLM> 3RD QTR FEB 28 NET ,UNIFAST INDUSTRIES INC ltUFST> YEAR NET ,AZTEC MANUFACTURING CO ltAZTC> 4TH QTR LOSS ,GAC LIQUIDATING TRUST ltGACTZ> YEAR NET ,NIGERIA TO ISSUE 15 BILLION DLRS OF NOTES ,INVESTOR HAS 80 PCT OF ALLEGHENY INTL ltAG> ,MCDONALDS ltMCD> TO BUY 107/8 PCT DEBENTURES ,SIERRACIN ltSER> PAYS DEBT GETS NEW LOAN PACT ,US CORPORATE FINANCE  NEW ZEALAND DLR FRNS ,US BILL SALES SEEN AT 574/72 582/81 PCT ,FRENCH TREASURY DETAILS PLANNED TAP ISSUE ,BANKS FILE SUIT AGAINST SAUDI COMPANY ,USLICO ltUSC> STARTS TRADING ON NYSE ,W AFRICA CENTRAL BANK WANTS IMF PARTICIPATION ,GAC LIQUIDATING TRUST ltGACTZ> SELLS LAND ,MCDONNELL ltMD> UNIT SIGNS PACT WITH MARTIN ltML> ,EXECUTIVE TELECOM ltXTEL> EXTENDS WARRANTS ,CENTRONICS ltCEN> NAMES SALOMON ltSB> AS ADVISOR ,ltCLAYTON AND DUBILIER INC> SELLS BURPEE ,US REGULATORS TO CONSIDER CBT EVENING SESSION ,GCA CORP ltGCA> YEAR ,DOW ltDOW> SEES RECORD ANNUAL PROFITS IN 1987 ,GANNETTS ltGCI> USA TODAYS ADVERTISING RISES ,CHEROKEE GROUP ltCHKE> 1ST QTR FEB 28 NET ,CRUDE OIL NETBACKS UP IN US MEDITERRANEAN ,BANKS FILE SUIT AGAINST SAUDI COMPANY ,ARIZONA NUCLEAR PLANT BEGINS FUEL LOADING ,INVESTOR GROUP HAS CIRCLE EXPRESS ltCEXX> STAKE ,PARADYNE ltPDN> LAUNCHES MODEMS NETWORK SYSTEM ,NIGERIA TO ISSUE 15 BILLION DLRS OF NOTES ,FEDERAL BANK BOARD CLOSES CALIFORINIA THRIFT ,CENTRAL/SOUTH WEST ltCSR> UNIT OFFERS PREFERRED ,VESTRON ltVV> IN SUIT OVER VIDEOCASSETTE RIGHTS ,FRENCH 1986/87 SOFT WHEAT EXPORTS FALL ,TEXACO SAYS IT FILED FOR REHEARING BY TEXAS APPEALS COURT OF PENNZOIL CASE
 ,STAN WEST ltSWMC> MAKES PRIVATE PLACEMENT ,IBC EXPECTED TO MAINTAIN COFFEE EXPORT FORMULA ,ltVISTA MANAGEMENT INC> TO MAKE ACQUISITION ,GOLDEN POULTRY ltCHIK> TO MAKE ACQUISITION ,WILLCOX AND GIBBS ltWG> TO MAKE ACQUISITION ,MISCHER CORP ltMSHR> 4TH QTR LOSS ,WICHITA INDUSTRIES INC ltWRO> 4TH QTR NET ,YELLOW FREIGHT ltYELL> FILES FOR RATE INCREASE ,INFODATA SYSTEMS INC ltINFD> 4TH QTR NET ,US REPLACING ALL MARINE SECURITY GUARDS IN MOSCOW ,SPORTS NEWS CYBERNETIC IN DEAL ,CITY RESOURCES ltCCIMF> TO SELL PROPERTY STAKE ,GENRAD ltGEN> OFFERS SOFTWARE FOR TESTING ,HUGHES SUPPLY ltHUG> TO MAKE ACQUISITION ,JMB REALTY TRUST ltJMBRS> 2ND QTR FEB 28 NET ,REPUBLIC PICTURES CORP ltRPICA> 4TH QTR LOSS ,EQUIPMENT CO OF AMERICA ltECOA> 4TH QTR NET ,ASHLAND OIL ltASH> SEEKS CHEMICAL ACQUISITIONS ,CHIRAC URGES EXCHANGE RATE STABILITY PLAN ,CERMETEK ltCRMK> INCREASES WORK WEEK ,OHIO MATTRESS ltOMT> IN ACQUISITION SETTLEMENT ,PROPOSED OFFERINGS RECENTLY FILED WITH THE SEC ,ltTOROMONT INDUSTRIES LTD> YEAR NET ,TEXACO ltTX> SEEKS PENNZOIL ltPZL> CASE REHEARING ,SABENA BEGINS BRUSSELSTORONTO SERVICE ,AMERON INC ltAMN> 1ST QTR FEB 28 LOSS ,ltTEXSCAN CORP> IN AGREEMENT WITH LENDERS ,YORK INTERNATIONAL ltYRK> TO MAKE ACQUISITIONS ,SAN/BAR ltSBAR> APPOINTS NEW PRESIDENT ,CARTERDAY SELLS ASSETS OF UNIT ,NUCLEAR SUPPORT ltNSSI> TO BUY ITT ltITT> HENZE ,COLONIAL BANCGROUP ltCLBGA> BUYS FARMERS ,GALACTIC ltGALCF> REVISES SUMMITVILLE ROYALTIES ,CUMMIN NAMED CHAIRMAN OF PHLCORP ltPHX> ,ROCHESTER TELEPHONE ltRTC> COMPLETES ACQUISITION ,PRUDENTIAL BORROWS FROM MINORITY BANKS ,CITY RESOURCES TO SELL GOLD PROPERTY STAKE ,WEST AFRICAN CENTRAL BANK SEEKS JOINING IMF TALKS ,TALKING POINT/WALL STREET STOCKS ,MAYFAIR ltMAYF> IN HERSHEY ltHSY> LICENSE DEAL ,HOME SHOPPING ltHSN> TO PURCHASE TV STATION ,COVINGTON TECHNOLOGIES INC ltCOVT> YEAR NET ,PARIS MEET AGREED NOT TO PUBLISH BANDS  LAWSON 
FIDATA ltFID> ANNOUNCES PRELIMINARY ESM SETTLEMENT ,LOUISVILLE GASltLOU> TO ASK PROTECTIVE MEASURES ,TRACOR ltTRR> UNIT WINS NAVY CONTRACT ,CAMPBELL SOUP ltCPB> TO SELL PLANT IN DELAWARE ,VIDEO DISPLAY ltVIDE> IN INDIAN JOINT VENTURE ,BASS GROUP SAYS IT HAS HAD TALKS ON SEEKING CONTROL OF TAFT BROADCASTING
 ,LOWER REFINERY OPERATIONS SEEN PRODUCING PROFITS ,NYNEX ltNYN> UNIT FILES 500 MLN DLR DEBT OFFERING ,HALIFAX ENGINEERING ltHX> GETS CONTRACTS ,ltELECTROLUX AB> UNIT TO BUILD WAREHOUSE ,SALOMON SA EUROCP/CREDIT TERMS DETAILED ,US EXPORT INSPECTIONS IN THOUS BUSHELS  SOYBEANS 17683 WHEAT 20717 CORN 36581
 ,REGULATORS TO CONSIDER CBT EVENING SESSION ,SONY INCREASING PRODUCTION ABROAD ,NEWMONT MINING ltNEM> PLANS 2FOR1 STOCK SPLIT ,MEXICO FUND ltMFX> TO BUY BACK TWO MLN SHARES ,QUARTZ ENGINEERING ltQRTZ> GETS SIEMENS ORDER ,DENPAC CORP ltDNPC> YEAR LOSS ,ltAIN LEASING CORP> 3RD QTR JAN 31 LOSS ,WARNERLAMBERT ltWLA> WINS PACKAGING SUIT ,HARTMARX ltHMX> UNIT PRESIDENT RESIGNS ,SENATE BILL WOULD ALLOW FARM LOAN WRITEDOWNS ,US SENATE BUDGET CHIEF EYES FARM POLICY CHANGE ,NEWMONT MINING ltNEM> SEEKS SOUTH AFRICAN SALE ,VENEZUELA WANTS TO BOOST ITS REFINING CAPACITY ,AUDI OFFERS CASH INCENTIVE TO CURRENT OWNERS ,PRIMEBANK ltPMBK> SETS 10 PCT STOCK DIVIDEND ,AMERICAN LOCKER GROUP INC ltALGI> 4TH QTR NET ,BASS GROUP SAYS IT HAS HAD TALKS ON TAFT ltTFB> ,US STEEL PRODUCTION ROSE 13 PCT IN WEEK ,NORTH AMERICAN GROUP ltNAMG> 4TH QTR OPER LOSS ,PAY N PAK ltPNP> TO EXPLORE ITS ALTERNATIVES ,SOCIETY FOR SAVINGS ltSOCS> TO OFFER NOTES ,ltOXOCO INC> YEAR LOSS ,TEECO PROPERTIES LP OPER INCOME DOWN ,BROUGHER INSURANCE GROUP INCltBIGI> 4TH QTR LOSS ,HIGH COURT DECLINES TO REVIEW AIR BAG RULE ,TRADE BODY SETS NEW RULES FOR EURODLR MANAGERS ,CSC INDUSTRIES UNIT TO INCREASE PRICES ,USDA TO UPDATE WINTER WHEAT ACREAGE TOMORROW ,SANTA FE ltSFX> AWARE OF HENLEY ltHENG> STAKE ,OXOCO CONCLUDES PRIVATE SALE OF NEW COMMON ,US SUGAR IMPORTS DOWN IN LATEST WEEK  USDA ,TRANSAMERICAN FILES AMENDED REORGANIZATION PLAN ,TEXTRON ltTXT> TO REPAY DEBT THROUGH ASSET SALES ,TEMPLETON ENERGY INC ltTMPL> 4TH QTR NET ,AEL INDUSTRIES ltAELNA> 4TH QTR FEB 27 NET ,AMOSKEAG ltAMKG> TAKEOVER BLOCKED BY COURT ,METROMAIL ltMTMA> PREDICTS FLAT EARNINGS ,APPLE ltAAPL> EXPANDS NETWORK CAPABILITIES ,BALL ltBLL> ENDS TALKS WITH MONSANTO ltMTC> ,JAPAN BUYS CANADIAN RAPESEED ,NEWMONT MINING ltNEM> SETS HIGHER SPENDING IN 1987 ,3COM CORP ltCOMS> INTRODUCES NEW WORKSTATION ,S/P AFFIRMS BANNER ltBNR> LOWERS REXNORD ltREX> ,REEF ENERGY ltRFEN> ENTERS PIPELINE AGREEMENT ,AMERON INC ltAMN> QTLY DIVIDEND ,JOHNSON ELECTRONICS INC ltJHSN> 4TH QTR LOSS ,TREASURY BALANCES AT FED FELL ON MARCH 27 ,MORRISON INC ltMORR> 3RD QTR FEB 28 NET ,FOREIGN OWNERSHIP OF US FARMLAND UP  USDA ,US GROUP ASKS SPECIAL ROYAL DUTCHltRD> MEETING ,VANDERBILT ltVAGO> TO RAISE COMMON MERGE ,LITTLE RISK SEEN FOR TEXAS COTTON FROM COLD ,REPORT ON EXPORT MARKETS FOR US GRAIN DELAYED ,BILZERIAN TELLS SEC HE UPS PAY N PAK STAKE TO 99 PCT
 ,ALLIEDSIGNAL ltALD> GETS 386 MLN DLR CONTRACT ,MORRISON ltMORR> SETS SHAREHOLDER RIGHTS PLAN ,RJR NABISCO SAYS SPINOFF OF TOBACCO OPERATIONS UNLIKELY
 ,ROYAL DUTCH ltRD> UNIT RAISES HEAVY FUEL PRICES ,FLORIDA WEEKLY CROP REPORT ,RJR NABISCO TO CONTINUE STUDYING ROLE OF LTD PARTNERSHIP IN TOBACCO OPERATIONS
 ,US SELLS 3MO BILLS AT 572 PCT STOP 574 PCT 6MO 580 PCT STOP 580 PCT
 ,BASS GROUP EMERGES AS POSSIBLE TAFTltTFB> BIDDERS ,HUGHES TOOL ltHT> US RIG COUNT FALLS TO 748 ,US TRADE OFFICIAL SAYS JAPAN ACTION FOOLISH ,US TRANSPORTATION DEPARTMENT APPROVES AMERICAN AIRLINESAIRCAL MERGER
 ,BILZERIAN UPS PAY N PAK ltPNP> STAKE TO 99 PCT ,CYACQ ENDS TENDER FOR CYCLOPS DIXONS AND AUDIO/VIDEO DISMISS LITIGATION
 ,US BILL AUCTION RATES AVERAGE 572 580 PCT ,RJR NABISCO ltRJR> SAYS TOBACCO SPINOFF UNLIKELY ,US FARM DISASTER BILL ATTRACTS AMENDMENTS ,FEDS POLICY EASE MAY END WITH 2ND QTR RATE CUT ,EC MINISTERS DIFFER WIDELY ON FARM PRICE PLAN ,LOUISIANA WEEKLY CROP REPORT ,SERVICE RESOURCES ltSRC> UNIT SETS PURCHASE ,LLE ROYALTY ltLRT> SETS MONTHLY PAYOUT ,GENOVA ltGNVA> TO MERGE INTO GENOVA PRODUCTS ,COLUMBIA GAS ltCG> IN SINKING FUND REDEMPTION ,IMPERIAL BANCORP ltIBAN> SETS FIVE PCT DIVIDEND ,TEXAS WEEKLY CROP REPORT ,MARRIOTT ltMHS> FRANCHISEES FORM MANAGEMENT CO ,ARKLA ltALG> PROPOSAL TO SETTLE DISPUTE ,BASIC AMERICAN ltBAMI> NOTE ISSUE CANCELED ,SERVICE RESOURCES ltSRC> UNIT IN ACQUISITION ,HYBRITECH ltHYBR> ASKS FOR REVIEW OF ITS PATENT ,SUNGARD ltSNDT> IN 48 MLN DLR CONTRACT ,AEC INC ltAECE> SETS REGULAR PAYOUT ,TIME ltTL> UNIT TO REDEEM 100 MLN DLRS IN NOTES ,SHELL CANADA SCHEDULES ANNUAL REFINERY SHUTDOWN ,DIXONS GROUP AUDIO/VIDEO ltAVA> END LITIGATION ,US DOT APPROVES AMERICAN ltAMR>ACI ltACF> PACT ,US CREDIT MARKETS END UNDER EXTREME PRESSURE ,STEEL TECHNOLOGIES ltSTTX> MITSUI SET VENTURE ,INLAND VACUUM ltIVAC> SETS STOCK SPLIT ,JOHNSON PRODUCTS INC ltJPC> 2ND QTR FEB 28 LOSS ,STEEL TECHNOLOGIES ltSTTX> IN JOINT VENTURE ,SALLIE MAE ANNOUNCES AUSTRALIAN DLR NOTE OFFER ,MAYNARD OIL CO ltMOIL> YEAR LOSS ,SECURITY TAG SYSTEMS ltSTAG> GETS RECORD ORDER ,KANSAS GAS AND ELECTRIC CO ltKGE> FEBRUARY NET ,ltJOURNEYS END MOTEL CORP> SIX MTHS JAN 31 NET ,NEOAX ltNOAX> BUYS REXNORD ltREX> UNIT ,FORMER OWNER SENTENCED IN OHIO THRIFT COLLAPSE ,ltRL CRAIN INC> 4TH QTR NET ,MIDAM EXCHANGE MOVES TO CBT FLOOR EXPANDS HOURS ,TIMES MIRROR ltTMC> SELLS TIMBERLANDS ,EXXON XON SEES SYNFUELS ROLE BY YEAR 2000 ,OKLAHOMA WEEKLY CROP REPORT ,BRAZIL TEMPORARILY LEGALISES DLR PARALLEL MARKET ,USX ltX> UNIT RAISES SOME STEEL PRICES ,ANGLO CHIEF URGES SAFRICA REPEAL DISCRIMINATION ,CANADA BANKS COULD SEE PRESSURE ON BRAZIL LOANS ,VENEZUELA PLANS METALS INVESTMENT FOR 198789 ,INVESTORS FILE PROXY FOR NEW HBO ltHBOC> BOARD ,INFINITY ltINFTA> TO PURCHASE AM/FM STATION ,NZ FEBRUARY CURRENT ACCOUNT DEFICIT 78 MLN V 93 MLN JAN  GOVT
 ,BULL AND BEAR GROUP INC ltBNBGA> YEAR END DEC 31 ,PROPOSED OFFERINGS RECENTLY FILED WITH THE SEC ,ENDOTRONICS ltENDO> REDUCES STAFF ,NAPLES FEDERAL ltNAF> REVISES LOAN AGREEMENT ,FRETTER INC ltFTTR> 4TH QTR JAN 31 NET ,AMFAC ltAMA> TO SELL STORE ,HARPER INTERNATIONAL ltHNT> IN ACQUISITION ,SARNEY TEMPORARILY LEGALISES DLR PARALLEL MARKET ,OLSON INDUSTRIES ltOLSN> TO SELL EGG OPERATIONS ,NZ FEBRUARY CURRENT ACCOUNT DEFICIT NARROWS ,GULF OF MEXICO RIG COUNT UNCHANGED THIS WEEK ,GENCORP REJECTS UNSOLICITED TAKEOVER BID FROM AFG INDUSTRIES/WAGNER AND BROWN
 ,GENCORP SAID IT IS DEVELOPING SUPERIOR ALTERNATIVE TO AFGS 100 DLR/SHR OFFER
 ,SEC WINS EXTENSION OF ORDERS AGAINST VASKEVITCH ,SOCIETY FOR SAVINGS ltSOCS> TO OFFER NOTES ,GROUP SELLS STAKE IN COMDATA NETWORK ltCDN> ,GENCORP ltGY> REJECTS UNSOLICITED TAKEOVER BID ,DOME MINES LTD ltDM> 4TH QTR NET ,SANTA ANITA ltSAR> TO BUILD IN COMMERCIAL PARK ,AH BELO ltBLC> TO REINCORPORATE ,PHILIPPINES TO REPAY SOME PRINCIPAL IN 198789 ,US SHOULD REASSESS MIDEAST POLICY  ANALYST ,SHEARSON SAYS SEC PROBING MARKET MANIPULATION ,SMITHFIELD ltSFDS> UNIT GETS UNFAIR LABOR CHARGE ,CRIBB NAMED REAGANS DOMESTIC AFFAIRS ADVISER ,ENVIROSURE MANAGEMENT CORP ltENVS> 1ST QTR LOSS ,COMMERCIAL METALS CO ltCMC> SETS QTLY DIVIDEND ,ARGENTINE DEBT TALKS FINELY POISED BANKERS SAY ,IMPERIAL ltICA> DECLARES FIRST DIV SINCE 1981 ,QUEBEC COURT UPHOLDS LABATT RACE CONTRACT ,Japan February unemployment falls to 29 pct 30 pct in January  official
 ,JAPAN UNEMPLOYMENT FALLS IN FEBRUARY ,PARTNERS CALL GENCORPltGY> RESPONSE UNPRODUCTIVE ,MIYAZAWA SAYS DOLLAR BELOW 150 YEN IS COUNTER TO PARIS ACCORD
 ,DLR BELOW 150 YEN COUNTER TO PARIS PACT  MIYAZAWA ,BANK OF JAPAN BUYS DOLLARS AROUND 14575 YEN  DEALERS
