BAHIA COCOA REVIEW ,STANDARD OIL ltSRD> TO FORM FINANCIAL UNIT ,TEXAS COMMERCE BANCSHARES ltTCB> FILES PLAN ,TALKING POINT/BANKAMERICA ltBAC> EQUITY OFFER ,NATIONAL AVERAGE PRICES FOR FARMEROWNED RESERVE ,ARGENTINE 1986/87 GRAIN/OILSEED REGISTRATIONS ,RED LION INNS FILES PLANS OFFERING ,USX ltX> DEBT DOWGRADED BY MOODYS ,CHAMPION PRODUCTS ltCH> APPROVES STOCK SPLIT ,COMPUTER TERMINAL SYSTEMS ltCPML> COMPLETES SALE ,COBANCO INC ltCBCO> YEAR NET ,OHIO MATTRESS ltOMT> MAY HAVE LOWER 1ST QTR NET ,AM INTERNATIONAL INC ltAM> 2ND QTR JAN 31 ,BROWNFORMAN INC ltBFD> 4TH QTR NET ,NATIONAL INTERGROUPltNII> TO OFFER PERMIAN UNITS ,ECONOMIC SPOTLIGHT  BANKAMERICA ltBAC> ,NATIONAL HEALTH ENHANCEMENT ltNHES> NEW PROGRAM ,DEAN FOODS ltDF> SEES STRONG 4TH QTR EARNINGS ,BONUS WHEAT FLOUR FOR NORTH YEMEN   USDA ,CREDIT CARD DISCLOSURE BILLS INTRODUCED ,HUGHES CAPITAL UNIT SIGNS PACT WITH BEAR STEARNS ,MAGMA LOWERS COPPER 075 CENT TO 66 CTS ,BROWNFORMAN ltBFDB> SETS STOCK SPLIT UPS PAYOUT ,ESQUIRE RADIO AND ELECTRONICS INC ltEE> 4TH QTR ,SHEARSON LEHMAN NAMES NEW MANAGING DIRECTOR ,BANKERS REPORT BREAKTHROUGH ON VENEZUELAN DEBT ,UNITED PRESIDENTIAL CORP ltUPCO> 4TH QTR NET ,TOWER REPORT DIMINISHES REAGANS HOPES OF REBOUND ,JANUARY HOUSING SALES DROP REALTY GROUP SAYS ,ASSETS OF MONEY MARKET MUTUAL FUNDS ROSE 7204 MLN DLRS IN LATEST WEEK
 ,US TAX WRITERS SEEK ESTATE TAX CURBS RAISING 67 BILLION DLRS THRU 1991
 ,SENATORS INTRODUCE EXPORT LICENSING REFORM BILL ,EXCELAN INC SETS INITIAL STOCK OFFER ,CCX NETWORK ltCCXN> SECONDARY OFFERING UNDERWAY ,FIRST UNION ltFUNC> FILES 100 MLN DLR NOTES ISSUE ,OWENS AND MINOR INC ltOBOD> RAISES QTLY DIVIDEND ,COMPUTER LANGUAGE RESEARCH IN ltCLRI> 4TH QTR ,ltCINRAM LTD> 4TH QTR NET ,DU PONT CO ltDD> LAUNCHES IMPROVED ARAMID FIBERS ,STANDARD TRUSTCO SEES BETTER YEAR ,HANDY AND HARMAN ltHNH> 4TH QTR LOSS ,ICO PRODUCERS TO PRESENT NEW COFFEE PROPOSAL ,SHULTZ SAYS NO RESIGNATION OVER IRAN REPORT ,MCLEANS ltMII> US LINES SETS ASSET TRANSFER ,CHEMLAWN ltCHEM> RISES ON HOPES FOR HIGHER BIDS ,US SUGAR IMPORTS DOWN IN WEEK  USDA ,BRAZIL ANTIINFLATION PLAN LIMPS TO ANNIVERSARY ,NZ OFFICIAL FOREIGN RESERVES FALL IN JANUARY ,AGENCY REPORTS 39 SHIPS WAITING AT PANAMA CANAL ,AMERICA FIRST MORTGAGE SETS SPECIAL PAYOUT ,REPUBLICANS EYE BIGGER US CONSERVATION RESERVE ,ARVIN INDS ltARV> PROMOTES EVANS TO PRESIDENT ,EMHART CORP ltEMH> QTLY DIVIDEND ,US DATA POINT TO CAPITAL SPENDING SLOWDOWN ,SENATORS INTRODUCE EXPORT LICENSING REFORM BILL ,AM INTERNATIONAL ltAM> CITES STRONG PROSPECTS ,CCC CREDITS FOR HONDURAS SWITCHED TO WHITE CORN ,ASSETS OF US MONEY FUNDS ROSE IN WEEK ,GULF BARGE FREIGHT RATES UP FURTHER ON CALL ,ARGENTINA COULD SUSPEND DEBT PAYMENTS  DEPUTY ,KEY US TAX WRITERS SEEK ESTATE TAX CURBS ,TREASURY BALANCES AT FED ROSE ON FEB 25 ,CANADAS WILSON SEEKS TEMPORARY BORROWING ,GULF APPLIED ltGATS> SELLS UNITS SEES GAIN ,FARMERS GROUP INC ltFGRP> 4TH QTR NET ,POTOMAC ELECTRIC POWER CO ltPOM> JAN NET ,SPRINGBOARD ltSPBD> IN DEAL ,ltCOFAB INC> BUYS GULFEX FOR UNDISCLOSED AMOUNT ,US WEEKLY SOYBEAN CRUSH 21782929 BUSHELS ,SCHULT HOMES OFFERING PRICED AT FIVE DLRS/UNIT ,TULTEX CORP ltTTX> SETS QUARTERLY DIVIDEND ,BURLINGTON ltBUR>  GETS 305 MLN DLR CONTRACT ,ROCKWELL ltROK> GETS 283 MLN DLR B1 CONTRACT ,ATICO FINANCIAL CORP ltATFC> 4TH QTR NET ,ICO EXPORTERS TO MODIFY NEW PROPOSAL ,US COMMERCIAL PAPER FALLS 375 MLN DLRS IN FEB 18 WEEK FED SAYS
 ,NY BUSINESS LOANS FALL 195 MLN DLRS IN FEB 18 WEEK FED SAYS
 ,NEW YORK BANK DISCOUNT WINDOW BORROWINGS 64 MLN DLRS IN FEB 25 WEEK
 ,QUEBECOR ltPQB> HEAD SEES NEW VENTURES LIKELY ,NEW YORK BUSINESS LOANS FALL 195 MLN DLRS ,NY BANK DISCOUNT BORROWINGS 64 MLN DLRS ,PHILIPPINE LONG DISTANCE ltPHI> YEAR NET ,LIBERTY ALLSTAR EQUITY FUND INITIAL DIV ,COLUMBIA GAS SYSTEM INC ltCG> REDEEMS DEBENTURES ,COMBUSTION ENGINEERING INC ltCSP> REGULAR DIV ,TONKA CORP ltTKA> RAISES DIVIDEND ,BDM INTERNATIONAL ltBDM> INCREASES QTRLY DIVS ,SORG ltSRG> STOCKHOLDERS FORM GROUP ,SYSTEMATICS INC ltSYST> REGULAR PAYOUT ,TEXAS INSTRUMENTS ltTXN> DEVELOPS NEW CHIP ,CONSOLIDATED GAS ltCNG>UNIT SAYS NO RULES BROKEN ,US M1 MONEY SUPPLY RISES 21 BILLION DLRS IN FEB 16 WEEK FED SAYS
 ,ltIVACO INC> YEAR NET ,US BANK DISCOUNT BORROWINGS AVERAGE 310 MLN DLRS IN FEB 25 WEEK FED SAYS
 ,US BANK NET FREE RESERVES 644 MLN DLRS IN TWO WEEKS TO FEB 25 FED SAYS
 ,INVESTMENT FIRMS CUT CYCLOPS ltCYL> STAKE ,ASCS TERMINAL MARKET VALUES FOR PIK GRAIN ,CORADIAN CORP ltCDIN> 4TH QTR NET ,NZ TRADING BANK DEPOSIT GROWTH RISES SLIGHTLY ,WORLD MARKET PRICE FOR UPLAND COTTON  USDA ,SUGAR QUOTA IMPORTS DETAILED  USDA ,GRAIN SHIPS LOADING AT PORTLAND ,IRAN ANNOUNCES END OF MAJOR OFFENSIVE IN GULF WAR ,MERIDIAN BANCORP INC ltMRDN> SETS REGULAR PAYOUT ,US BANK DISCOUNT BORROWINGS 310 MLN DLRS ,AMERICAN EXPRESS ltAXP> SEEN IN POSSIBLE SPINNOFF ,US M1 MONEY SUPPLY ROSE 21 BILLION DLRS ,GENERAL BINDING ltGBND> IN MARKETING AGREEMENT ,LIBERTY ALLSTAR ltUSA> SETS INITIAL PAYOUT ,COCA COLA ltKO> UNIT AND WORLD FILM IN VENTURE ,FORD MOTOR CREDIT ltF> TO REDEEM DEBENTURES ,STERLING SOFTWARE ltSSW> NOTE HOLDERS OK BUY ,ltSCHULT HOMES CORP> MAKES INITIAL STOCK OFFER ,FLUOR ltFLR> UNIT GETS CONSTRUCTION CONTRACT ,SUFFIELD FINANCIAL CORP ltSFCP> SELLS STOCK ,ltHIGH POINT FINANCIAL CORP> SETS OFFERING ,CHINESE PORK OUTPUT SEEN LOWER  USDA ,LANDMARK BANCSHARES ltLBC> TO BE LISTED ON NYSE ,IVACO SEES MINIMAL FIRST QUARTER EARNINGS ,US GRAIN CARLOADINGS FALL IN WEEK ,HONG KONG FIRM UPS WRATHERltWCO> STAKE TO 11 PCT ,COLECO INDUSTRIES INC ltCLO> 4TH QTR ,DIAMOND SHAMROCK DIA CUTS CRUDE PRICES ,LIEBERT CORP ltLIEB> APPROVES MERGER ,NORTHERN TELECOM PROPOSES TWOFORONE STOCK SPLIT
 ,COLECO INDUSTRIES ltCLC> SEES PROFIT IN 1987 ,OLIN CORP ltOLM> TO ELECT NEW CEO IN APRIL ,GULF APPLIED TECHNOLOGIES ltGATS> SELLS UNITS ,INVESTMENT GROUP RAISES ROBESON ltRBSN> STAKE ,GAO LIKELY TO SHOW CERTS MORE COSTLY THAN CASH ,Venezuela seeks flexibility from banksazpurua ,DAHLBERG INC ltDAHL> 4TH QTR NET ,CITY NATIONAL CORP ltCTYN> RAISES DIVIDEND ,ltPAGE PETROLEUM LTD> YEAR LOSS ,THOMSON MCKINNON UNITS CMO OFFERING PRICED ,IDB COMMUNICATIONS GROUP INC ltIDBX> YEAR NET ,ARMOR ALL PRODUCTS CORP ltARMR> QUARTERLY DIV ,OPEC MAY HAVE TO MEET TO FIRM PRICES  ANALYSTS ,CENERGY ltCRG> REPORTS 4TH QTR NET PROFIT ,NORTHERN TELECOM LTD ltNT> DECLARES STOCK SPLIT ,TORCHMARK ltTMK> AUTHORIZES STOCK REPURCHASE ,PAINEWEBBER GROUP ltPWJ> TO REDEEM DEBENTURES ,RP SCHERER ltSCHC> SETS PREFERRED STOCK OFFER ,PARLUX FRAGRANCES COMPLETES INITIAL OFFERING ,TECHAMERICA GROUP INC ltTCH> 4TH QTR LOSS ,WILFRED AMERICAN EDUCATIONAL ltWAE> REGULAR DIV ,DREXEL OFFICIAL HAS STAKE IN EPSILON DATA ltEPSI> ,PROPOSED OFFERINGS RECENTLY FILED WITH THE SEC ,VARIAN ltVAR> SIEMENS FORM JOINT VENTURE ,DU PONT ltDD> WINS SUIT AGAINST PHILLIPS ltP> ,ltNOVA> WINS GOVERNMENT OKAY FOR HUSKY ltHYO> DEAL ,PRESIDENTIAL AIRWAYS ltPAIR> PACT APPROVED ,ARMY TO RENEGOTIATE ITT ltITT> RADIO CONTRACT ,POTOMAC ELECTRIC POWER CO ltPOM> JANUARY NET ,TORCHMARK ltTMK> SELLS SINKING FUND DEBENTURES ,SUFFIELD FINANCIAL ltSSBK> GETS FED APPROVAL ,AFG INDUSTRIES INC ltAFG> QUARTERLY DIVIDEND ,ltGSW INC> YEAR NET ,SANTA ANITA REALTY ltSAR> QUARTERLY DIVIDEND ,LIQUID AIR CORP ltLANA> QUARTERLY DIVIDEND ,MARSHALL STEEL LTD YEAR NET ,MARSHALL STEEL DETAILS GAIN FROM UNIT SALE ,MAYFAIR INDUSTRIES INC ltMAYF> 4TH QTR NET ,CORRECTED  BANPONCE ltBDEP> PLACES NOTES ,US TREASURY SAYS IT WILL PARTICIPATE WITH OTHERS IN 500 MLN DLR BRIDGE LOAN TO ARGENTINA
 ,US REGULATOR CLOSES BANKS IN TEXAS LOUISIANA ,OLIN ltOLN> NAMES SUCCESSOR FOR CHIEF EXECUTIVE ,DAEWOO MOTOR TO BOOST IMPORTS OF US GOODS ,BANKS EXPRESS GRAVE CONCERN ON BRAZIL DEBT MOVES ,LNG IMPORTS FROM ALGERIA UNLIKELY IN 1987 ,US FARM CREDIT RESCUE BILL SEEN BEFORE EASTER ,REPORT COULD BE FINAL BLOW FOR REGAN ,SWISS ECONOMY IN EXCELLENT CONDITION OECD SAYS ,US WHEAT BONUS TO SOVIET CALLED DORMANT ,US TREASURY PART OF ARGENTINE BRIDGE LOAN ,COMPANIES SET BID FOR CANADA HELICOPTER CONTRACT ,ALATENN RESOURCES INC ltATNG> 4TH QTR NET ,AMERICAN TRAVELLERS ltATVC> EXPANDS OPERATIONS ,VERSATILE TO SELL UNIT TO VICON ,VIDEOTRON BUYS INTO EXHIBIT COMPANY ,ltMEMOTEC DATA INC> YEAR NET ,ROHR INDUSTRIES ltRHR> SETTLES STRIKE ,TEXACO CANADA CUTS CRUDE PRICES 64 CANADIAN CTS/BBL PAR GRADE TO 2226 CANADIAN DLRS
 ,BANKS EXPRESS GRAVE CONCERN ON BRAZIL DEBT MOVE ,TEXACO CANADA ltTXC> LOWERS CRUDE POSTINGS ,JURY FINDS FOR DOW ltDOW> IN BIRTH DEFECT CASE ,USDA SAID UNLIKELY TO BROADEN CORN BONUS OFFER ,MARATHON PETROLEUM REDUCES CRUDE POSTINGS ,AGENCY VOTES TO END LOCAL NUCLEAR PLANT VETO ,ltGEORGE WESTON LTD> YEAR NET ,RELIEF TO US CORN/OATS GROWERS SAID LIKELY ,NZ MONEY SUPPLY RISES 36 PCT IN DECEMBER ,CIRCUIT SYSTEMS ltCSYI> BUYS BOARD MAKER ,FALLING SOYBEAN CRUSH RATIOS CUT OUTPUT ,MAIL BOXES ETC ltMAIL> 3RD QTR JAN 31 NET ,MUNSINGWEAR INC ltMUN> 4TH QTR JAN 3 LOSS ,FED DATA SUGGEST STABLE US MONETARY POLICY ,FEDERAL INDUSTRIES LAUNCHES EUROBOND ISSUE ,NYSE TO STUDY REGULATION OF SECURITY INDUSTRY ,KOREAN AIR ORDERS MCDONNELL DOUGLAS ltMD> MD11S ,DELTA ROCKET BLASTS OFF FROM CAPE CANAVERAL ,JAPAN TO TRY TO OPEN MARKET TO US CAR PARTS ,FRANCE FACES PRESSUE TO CHANGE POLICIES ,GTI CORP ltGTI> 4TH QTR OPER NET ,HOUSTON OIL ltHO> RESERVES STUDY COMPLETED ,FAMOUS RESTAURANTS INC ltFAMS> 4TH QTR LOSS ,JAPAN CONSUMER PRICES FALL 04 PCT IN JANUARY ,AVERY ltAVY> SETS TWO FOR ONE STOCK SPLIT ,MICROSOFT CORP ltMSFT> HALTS MSDOS IMPORTS ,JAPAN MARCH BOND COUPON SEEN UNCHANGED AT FIVE PCT ,US LAUNCHES WEATHER SATELLITE ,ITALIAN COALITION MEETS AS GOVERNMENT CRISIS LOOMS ,NZ CENTRAL BANK SEES SLOWER MONEY CREDIT GROWTH ,AVERAGE YEN CD RATES FALL IN LATEST WEEK ,BRITAINS ALLIANCE OPPOSITION WINS BYELECTION ,ECONOMIC SPOTLIGHT  JAPAN EYEING FOREIGN STOCKS ,TAIWAN OFFSHORE BANKING ASSETS RISE IN JANUARY ,JAPAN EXPECTED TO CUT BASE RATE FOR STATE BODIES ,JAPAN HOUSE BUDGET TALKS TO REOPEN NEXT WEEK ,AUSTRALIAS KEATING CHANGES ECONOMIC FORECASTS ,THAI RICE EXPORTS RISE IN WEEK ENDED FEBRUARY 24 ,TOKYO GRAIN EXCHANGE TO RAISE MARGIN REQUIREMENTS ,MANILA SAID TO OFFER DEBT BONDS TO BANKS ,POLL MAJORITY DISAPPROVE OF REAGAN PRESIDENCY ,PRODUCER SPLIT HEATS UP COFFEE QUOTA TALKS ,ITALIAN TREASURY CUTS INTEREST ON CERTIFICATES ,BRITISH CONSERVATIVES AHEAD OF LABOUR IN NEW POLLS ,INDONESIAN AGRICULTURE GROWTH EXPECTED TO SLOW ,KUWAIT SAYS NO PLANS FOR EMERGENCY OPEC TALKS ,INDONESIA SEEN AT CROSSROADS OVER ECONOMIC CHANGE ,INDIAN BUDGET COMES IN FOR WIDE CRITICISM ,CHINA TO BORROW 390 MLN DLRS ,MANILA SAID TO OFFER DEBT BONDS TO BANKS ,CHINESE WHEAT CROP THREATENED BY PESTS DISEASE ,SAUDI RIYAL DEPOSIT RATES REMAIN FIRM ,IRAN CLAIMS NEW VICTORIES NEAR BASRA ,BANGLADESH MOVES AGAINST LOAN DEFAULTERS ,IRAQ SAYS IT REPELS IRANIAN ATTACK ,QATAR UNVEILS BUDGET FOR FISCAL 1987/88 ,GULF BOND STOCK MARKETS LAG BEHIND GIB SAYS ,SAUDI ARABIA REITERATES COMMITMENT TO OPEC PACT ,COFFEE QUOTA TALKS CONTINUE NO ACCORD SEEN LIKELY ,NEW ZEALAND CANCELS WEEKLY TBILL TENDER ,SHARE TRADING IN CHEUNG KONG GROUP SUSPENDED ,FEBRUARY US PURCHASING MANAGER INDEX FALLS ,CANADAEGYPT WHEAT NEGOTIATIONS TO CONTINUE ,INDONESIAN WHEAT IMPORTS EXPECTED TO FALL IN 1987 ,SHULTZ LIKELY TO VISIT MOSCOW SOON ,ZAMBIA TO RETAIN CURRENCY AUCTION SAYS KAUNDA ,POLISH BANKER PLEASED WITH WORLD BANK IMF TALKS ,RECORD NZ FUTURES VOLUMES TRADED IN FEBRUARY ,INDONESIAN SUGAR OUTPUT SEEN SHORT OF TARGET ,NIPPON KOKAN STEEL AFFILIATES CONSIDERING MERGER ,Qantas Airways says will buy four Boeing 747400s for one billion Australian
 ,EGYPT TO HOST NINENATION AFRICAN TALKS THIS MONTH ,EC MINISTERS CONSIDER BIG AGRICULTURE PRICE CUTS ,QANTAS TO BUY FOUR 747400S FOR ONE BILLION DLRS ,IEL SETS 100 MLN DLR NOTE/COMMERCIAL PAPER ISSUE ,AMERICAN EXPRESS STUDIES OPTIONS FOR SHEARSON ,INDONESIA UNLIKELY TO IMPORT PHILIPPINES COPRA ,SRI LANKAN BANK OFFERS 250 MLN RUPEES TBILLS ,STRONG EARTHQUAKE HITS NEW ZEALAND ,PHILIPPINES HEADS CONFIDENTLY INTO DEBT TALKS ,JAPAN FEBRUARY INTERIM TRADE SURPLUS JUMPS ,NIPPON LIGHT METAL CONTINUES ALUMINIUM OUTPUT CUT ,SAUDI FEBRUARY CRUDE OUTPUT PUT AT 35 MLN BPD ,INDONESIAN PALM OIL OUTPUT EXPECTED TO RISE ,INDONESIAN TEA COCOA EXPORTS SEEN UP COFFEE DOWN ,SINGAPORE EXCHANGE SEEKING NASDAQ/LONDON LINK ,INDONESIAS EXPORTS DROP IN CALENDAR 1986 ,GERMAN EUROBOND MARKET EXPECTS BREATHING SPACE ,JAPANS NTT FORECASTS PROFITS FALL IN 1987/88 ,SINOUS VENTURE IN CHINA TO MAKE RINSING AGENTS ,CHINA SIGNS WORLD BANK LOAN FOR TIANJIN PORT ,THAI AIRWAYS INTERNATIONAL TO ALMOST DOUBLE FLEET ,Japan February external reserves record 5173 billion dlrs January 5146 billion
 ,JAPAN FEBRUARY RESERVES RECORD 5173 BILLION DLRS ,SIMEX TRADING VOLUME HITS RECORD IN FEBRUARY ,SHULTZ VISIT TO MOSCOW POSSIBLE SAY SOVIETS ,JAPAN DISTRIBUTOR MAY IMPORT MAZDA USMADE CARS ,IRAQ DEFERS PAYMENTS ON 500 MLN DLR EUROLOAN ,TAIWAN CENTRAL BANK ISSUES CERTIFICATES OF DEPOSIT ,ICO TALKS ON COFFEE QUOTAS TO RESUME AT NOON ,CAECL ISSUES 12 BILLION YEN EUROBOND ,CHINESE BANKS TO ISSUE MORE BONDS OFFICIAL SAYS ,INDIAN SUGAR OUTPUT RISES IN FIRST FOUR MONTHS ,INTERNATIONAL LEISURE NEGOIATING ON BOEING LEASE ,JAPAN PLANS MORE FLEXIBLE CORPORATE BOND ISSUES ,NEW DUTCH ADVANCES TOTAL 48 BILLION GUILDERS ,JAPAN BUYS SOME 95000 TONNES SOYBEANS FROM CHINA ,SHV SAYS IT MAKING TENDER OFFER FOR UP TO 33 MLN SHARES IN IC GAS
 ,CHEUNG KONG HOLDINGS LTD ltCKGHHK> YEAR 1986 ,TRADING DELAYED ON SINGAPORES NEW BILL MARKET ,MERRILL LYNCH ISSUES 100 MLN ECU EUROBOND ,WALLENBERGS FIGHT BID FOR SWEDISH MATCH STAKE ,INDONESIAN SOYBEAN IMPORTS FORECAST TO RISE ,SHV SAYS IT MAKING TENDER OFFER FOR IC GAS ,NOBEL/FINANCIERE ROBUR ISSUE FRENCH FRANC BONDS ,JAPANESE BANKS COOL ON NIGERIAN DEBT TALKS ,UK MONEY MARKET DEFICIT FORECAST AT 800 MLN STG ,JAPAN SALES TAX MAY FORCE NAKASONE OUT OF OFFICE ,BLACK MINERS SUPPORT S AFRICAN MINES TAKEOVER ,THAILAND ANNOUNCES THIRD TAPIOCA QUOTA FOR EC ,ATPC MEMBERS FIND WAYS TO CURB TIN EXPORTS ,SOUTH KOREA TO HOLD CURRENT ACCOUNT SURPLUS DOWN ,DUTCH OILSEEDS/FATS IMPORTS ROSE IN 1986 ,CHINAS HEILONGJIANG PROVINCE BOOSTS GOLD OUTPUT ,SALE TILNEY BUYS STAKE IN US INSURANCE BROKER ,SAN MIGUEL BOARD APPOINTMENT MAY MEAN CHANGES ,ESTIMATED DROP IN JAPAN CORPORATE PROFITS TRIMMED ,LEBANESE PRESIDENT AGREES NEW PEACE MOVES ,INDIAN BUDGET DEFICIT SEEN FUELING INFLATION ,INDIA BUYS 46000 TONNES OF VEGETABLE OILS ,BEECHAM UNIT LAUNCHES ARTHRITIS DRUG ,JAPAN TO PROMOTE INTEREST RATE LIBERALISATION ,TAIWAN POWER FIRM PLANS MORE FOREIGN DEBT CUTS ,CREDITORS ALLOW TECK HOCK TO FULFIL CONTRACTS ,TESCO ISSUES 100 MLN STG CONVERTIBLE BOND ,SNCF ISSUING THREE BILLION FRANC DOMESTIC BOND ,DUTCH ANIMAL FEED USAGE DOWN IN FIRST HALF SEASON ,REUTERS TO CARRY JIJI FINANCIAL SERVICES ,FIAT UNIT ISSUES 100 MLN DLR BOND AND WARRANTS ,UK CONFIRMS JANUARY STERLING M3 RISE ,EXCO BUYS US GOVERNMENT SECURITIES BROKER ,PAKISTAN TO TENDER FOR RBD PALM OIL ,HOECHST TO RESEARCH DISCS WITH US JAPAN FIRMS ,COLOROLL AGREES TO BUY US WALLCOVERINGS COMPANY ,ECONOMIC SPOTLIGHT  AUSTERITY MEASURES IN HUNGARY ,UK MONEY MARKET SHORTAGE FORECAST REVISED DOWN ,ALASKA HOUSING HAS 150 MLN DLR SYNDICATED LOAN ,SWEDEN TO GO AHEAD WITH S AFRICAN TRADE SANCTIONS ,DIGITAL AUDIO TAPE PLAYERS GO ON SALE IN JAPAN ,ECONOMIC SPOTLIGHT  ITALIAN BOOM ,UK MONEY MARKET RECEIVES 37 MLN STG ASSISTANCE ,JAPAN US SET TO BEGIN HIGHLEVEL TRADE TALKS ,INDIA TO HOLD WHITE SUGAR BUYING TENDER ,QANTAS TO BUY FOUR 747400S FOR ONE BILLION DLRS ,CARLTON COMMUNICATIONS OPTIMISTIC FOR 1987 ,EC OPENS ANTIDUMPING ENQUIRY INTO SOVIET MERCURY ,MANILA SAID TO OFFER DEBT BONDS TO BANKS ,ARGENTINE DEBT NEGOTIATOR CONFIDENT OF ACCORD ,GULF ARAB DEPUTY OIL MINISTERS TO MEET IN BAHRAIN ,MANILA OFFICIALS SPLIT OVER DEBT STRATEGY ,OECD SAYS JAPAN RESOLVED TO STIMULATE DEMAND ,SAUDI ARABIA REITERATES COMMITMENT TO OPEC ACCORD ,KUWAIT MINISTER SAYS NO EMERGENCY OPEC TALKS SET ,TAIWAN PLANS NEW TARIFF CUTS ,RHONEPOULENC TO LAUNCH INVESTMENT CERTIFICATES ,HUTCHISON SEES HIGHER PAYOUT SATISFACTORY PROFITS ,BALLADUR EXPECTS IMPROVED FEBRUARY INFLATION DATA ,FEBRUARY US PURCHASING MANAGER INDEX FALLS ,FUNARO SAYS BRAZIL NEEDS MORE FASTER FINANCE ,AMERICAN MOTORS ltAMO> BREAKS OFF TALKS ON PLANT ,SCIENTIFIC MICRO SYSTEMS ltSMSI> ACUIRES SUPERMAC ,AMERICAN EXPRESS ltAXP> VIEWING SHEARSON OPTIONS ,SPANISH FARMERS PROTEST THEN CALL TRUCE ,SWISS HAVE NET GAIN IN 1985 GOVERNMENT FINANCES ,TWO S/L FAILURES RAISE US 1987 TOLL TO 10 ,ROPAK ltROPK> HAS 34 PCT OF BUCKHORN ltBKN> ,APPLE COMPUTER ltAAPL> UPGRADES MACINTOSH LINE ,PHILADELPHIA PORT CLOSED BY TANKER CRASH ,PENRIL ltPNL> SEEKS TO SELL TWO UNITS ,LL/E ROYALTY ltLRT> REVENUES MAY BE ESCROWED ,ltDALE BURDETT INC> FACES DAMAGE CLAIM ,PUROLATOR ltPCC> IN BUYOUT WITH HUTTON ltEFH> ,NCR ltNCR> SIGNS LICENSE AGREEMENT ,PAKISTAN COTTON OUTPUT REACHES 77 MLN BALES ,IMPERIAL CHEMICAL ltIMP> FORMS NEW UNIT ,FINANCIAL SANTA BARBARA ltFSB> TO MAKE PURCHASE ,ALCAN TO CLOSE WEST GERMAN ALUMINIUM SMELTER ,BBC AG BROWN BOVERI UND CIE ltBBCZZ> 1986 YEAR ,MARRIOTT ltMHS> TO SELL HOTEL ,DH TECHNOLOGY ltDHTK> CHAIRMAN SELLS SHARES ,BROWN BOVERI OMITS DIVIDEND PLANS WARRANT BOND ,US CORPORATE FINANCE  ASSETBACK MARKET GROWS ,VIACOM SAID IT HAS NEW NATIONAL AMUSEMENTS MCV HOLDINGS BIDS
 ,ILC TECHNOLOGY ltILCT> OFFICER REMOVED ,APPLE COMPUTER ltAAPL> HAS NEW MACINTOSH MODELS ,REAGAN AND BAKER BEGIN TASK OF REBUILDING ,LAROCHE STARTS BID FOR NECO ltNPT> SHARES ,ltSDC SYDNEY DEVELOPMENT CORP> NINE MTHS LOSS ,SENIOR ENGINEERING MAKES 125 MLN DLR US PURCHASE ,CHEUNG KONG CHAIRMAN SEES STRONG RESULTS IN 1987 ,OCCIDENTAL ltOXY> UNIT TO REDEEM DEBENTURES ,WHITTAKER CORP 1ST QTR OPER SHR 17 CTS VS 25 CTS
 ,VIACOM ltVIA> RECEIVES TWO REVISED OFFERS ,DOW ltDOW> TO OFFER 130 MLN DLRS IN SWISS NOTES ,FRENCH ESTIMATE 86/87 WHEAT DELIVERIES UNCHANGED ,WASTE MANAGEMENT CORP VOTES TWO FOR ONE STOCK SPLIT AND BOOSTS QTLY DIVIDEND TO 18 CTS
 ,WRITERS GUILD OF AMERICA STRIKES TWO NETWORKS ,PITTSTON AGREES TO ACQUIRE WTC INTERNATIONAL IN EXCHANGE OF STOCK
 ,TUESDAY MORNING INC ltTUES> 4TH QTR NET ,DIAGNOSTIC/RETRIEVAL SYSTEMS INC MAKES 53 MLN DLR BID FOR ROSPATCH CORP
 ,MILLER TABAK HAS 918 PCT OF PENN TRAFFIC ltPNF> ,COFFEE QUOTA TALKS CONTINUE BUT NO AGREEMENT YET ,FEDERAL INDUSTRIES SETS COMMERCIAL PAPER ISSUE ,WASTE MANAGEMENT ltWMX> VOTES SPLIT UPS PAYOUT ,POREX TECHNOLOGIES ltPORX> SETS INITIAL DIVIDEND ,DAVIS WATER ltDWWS> DECLARES STOCK DIVIDEND ,MEDCO CONTAINMENT ltMCCS> SETS INITIAL PAYOUT ,PITTSTON ltPCO> AGREES TO ACQUIRE WTC ltWAF> ,SDC SYDNEY COST REVIEW MAY ELIMINATE PRODUCTS ,ltMULTISTEP PRODUCTS INC> SIX MTHS DEC 31 LOSS ,UK MONEY MARKET OFFERED BORROWING FACILTIES ,ELECTRONIC MAIL ltEMCA> FINANCING ATTEMPT FAILS ,NETHERLANDS GRANTS 47 MLN DLRS TO BANGLADESH ,QUEBECS CAISSE DES JARDINS ISSUES YEN EUROBOND ,DOW CHEMICAL LAUNCHES 200 MLN SWISS FRANC BOND ,SWISS SIGHT DEPOSITS RISE 310 BILLION FRANCS ,CONSOLIDATED TVX SAYS IT WILL ISSUE SHARES TO BUY STAKES IN THREE BRAZIL MINING FIRMS
 ,BRAZIL CRITICISES ADVISORY COMMITTEE STRUCTURE ,WHITTAKER CORP ltWKR> 1ST QTR JAN 31 NET ,QUEBECS CAISSE DES JARDINS ISSUES YEN EUROBOND ,STOP AND SHOP COS INC ltSHP> 4TH QTR JAN 31 NET ,JIM WALTER CORP ltJWC> REGULAR DIVIDEND ,DIAGNOSTIC ltDRS> MAKES A BID FOR ROSPATCH ltRPCH> ,RECORD NZ FUTURES VOLUMES TRADED IN FEBRUARY ,AIR FORCE EXERCISES OPTION FOR AAR ltAIR> ORDER ,DOW CHEMICAL LAUNCHES 200 MLN SWISS FRANC BOND ,TANZANIA SAYS NO NEED FOR NEW ECONOMIC MEASURES ,TAIWAN TO SEEK HIGHER TEXTILE EXPORTS TO US ,US JAN CONSTRUCTION SPENDING ROSE 10 PCT AFTER REVISED 09 PCT DEC DROP
 ,US NONFARM PRODUCTIVITY FELL REVISED 22 PCT IN 4TH QTR INSTEAD OF 17 PCT
 ,US NONFARM PRODUCTIVITY FELL 22 PCT IN QTR , FRENCH 13WEEK TBILL AVERAGE RATE FALLS TO 769 PCT FROM 782 PCT
 ,US CONSTRUCTION SPENDING ROSE 10 PCT IN JAN ,WHITTAKER ltWKR> TO HAVE GAINS FROM SALES ,THE JAPAN FUND ltJPN> GETS BUYOUT OFFER ,STANSBURY MINING ltSTBY> GETS FUNDING FOR MINE ,ltSAMSUNG CO> CALENDAR 1986 ,ltDAEWOO CORP> CALENDAR 1986 ,CORNING TO OFFER 05165 SHARE FOR EACH HAZLETON SHARE UNDER EARLIER AGREEMENT
 ,BANK OF NEW YORK ltBK> TO HAVE GAIN ON UNIT SALE ,CORNING ltGLW> HAZLETON ltHLC> SET EXCAHNGE RATIO ,HEALTH EXPERTS URGE ERADICATION OF RINDERPEST ,TURKISH RETAIL PRICES RISE 27 PCT IN FEBRUARY , bank of england announces creation of further one billion stg of nine pct 2002 exchequer stock
 ,XEROX CORP ltXRX> ADDS CAPACITY TO SYSTEM ,BALLY ltBLY> COMPLETES PURCHASE OF GOLDEN NUGGET ,CONSOLIDATED TVX TO BUY BRAZIL GOLD MINE STAKES ,WARWICK INSURANCE MANAGERS INC ltWIMI> 4TH QTR ,CANADA INDUSTRIAL PRICES UP 02 PCT IN MONTH ,OLIVERS STORES ltOLVR> FILES CHAPTER 11 ,HOWE OWNERS FEDERAL ltHFSL> HOLDERS OK MORE STOCK ,COMMERZBANK UNIT ISSUES STERLING EUROBOND ,NUCLEAR DATA ltNDI> GETS EXTENSIONS ON LOANS ,GELCO CORP 2ND QTR SHR 67 CTS VS 23 CTS
 ,STROBER ORGANIZATION INC ltSTRB> 4TH QTR NET ,JUDGE RULES IN FAVOR OF DOW CHEM ltDOW> UNIT ,UK SAYS HAS NO ROLE IN BRAZIL MORATORIUM TALKS ,SHELL CANADA CUTS CRUDE OIL PRICES BY UP TO 127 CANADIAN DLRS/BBL EFFECTIVE MARCH ONE
 ,BANK OF ENGLAND ANNOUNCES ONE BILLION STG TAP ,BRENCO INC ltBREN> DECLARES QTLY DIVIDEND ,BLACK SOUTH AFRICAN MINERS SEEK WAGE RISE ,PRIME COMPUTER ltPRM> UNVEILS PC SOFTWARE ,MASSACHUSETTS INVESTORS GROWTH STOCK FUND PAYOUT ,FEDERAL INDUSTRIES PAPER ISSUE JUST IN CANADA ,ltPREMDOR INC> 4TH QTR NET ,AMERICAN NURSERY ltANSY> BUYS FLORIDA NURSERY ,JUTLAND TELEPHONE SETS 75 MLN SWISS FRANC BOND ,REGENCY CRUISES INC ltSHIP> ELECTS NEW CHAIRMAN ,MFS MANAGED SECTORS TRUST DIVIDEND INCREASED ,UNOCAL ltUCL> PLANS LUBE CENTERS AT TRUCKSTOPS ,ltGENZYME> PFIZER ltPFE> UNIT IN JOINT VENTURE ,MULTISTEP TO SELL LADDER UNIT CANCEL SHARES ,ESSELTE BUSINESS ltESB> UNIT BUYS ANTONSON UNIT ,FED EXPECTED TO ADD TEMPORARY RESERVES ,REUTER DEALING SERVICE INTRODUCED IN CHINA ,CAMBRIDGE MEDICAL ltCMTC> IN DEAL ON AIDS TEST ,FOUR SEASONS BUYING MARRIOTT ltMHS> HOTEL ,QUAKER OATS ltOAT> FILES SHELF REGISTRATION ,STONE ltSTO> SPLITS STOCK RAISES PAYOUT ,TEMPLE INLAND/INTL PAPER UP ON RAISED OPINION ,PRESIDENTIAL AIR ltPAIR> TO START NEW SERVICE ,SKI LTD ltSKII> 2ND QTR JAN 25 NET ,KAPOK CORP ltKPK> YEAR SEPT 30 LOSS ,COUPON REDUCED ON BEST DENKI WARRANT BOND ,CARGILL UK STRIKE TALKS POSTPONED ,LOTUS ltLOTS> INTRODUCES NEW SOFTWARE ,AMAX ltAMX> IN GOLD SILVER FIND ,STUDY GROUP URGES INCREASED US OIL RESERVES ,KTRON INTERNATIONAL INC ltKTII> 4TH QTR NET ,FORD ltF> INCREASES 2ND QTR OUTPUT PLANS REPORT ,FNMA ltFNM> ARRANGES MORTGAGE SECURITIES SWAP ,MCI ltMCIC> GETS PENNEY ltJCP> CONTRACT ,PRESIDENTIAL REALTY CORP ltPDO> ANNUAL NET ,FORD INCREASES 2ND QTR OUTPUT PLANS REPORT SAYS ,REDSTONE DETAILS SWEETENED VIACOM ltVIA> OFFER ,MONTEDISON CONCLUDES TALKS WITH ANTIBIOTICOS ,UTILICORP ltUCU> COMPLETES ACQUISITION ,ARMCO ltAS> CHANGES EUROPEAN MARKETING UNIT ,FAA FINES DELTA ltDAL> 140400 DLRS ON SAFETY ,TRADERS DETAIL FRENCH CEREAL EXPORT REQUESTS ,STUDY GROUP URGES INCREASED US OIL RESERVES ,NCR CORP ltNCR> UNIT SIGNS DISTRIBUTION PACT ,CARBIDE ltUK> LOOKS TO ACQUISITIONS FOR GROWTH ,CORRECTED  BANKAMERICA NEGOTIATING SALE OF UNITS ,ltFRANKLIN GOLD FUND> CUTS DIVIDEND ,COLUMBIA GAS ltCG> FORMS ERIE PIPELINE SUBIDIARY ,ltFRANKLIN CALIFORNIA TAXFREE INCOME FUND>PAYOUT ,ltFRANKLIN AGE HIGH INCOME FUND> SETS PAYOUT ,RJR NABISCO UNIT FORMS OVERSEEING COMMITTEE ,PETROCANADA CUT CRUDE PRICES BY 143 CANADIAN DLRS/BBL EFFECTIVE MARCH ONE
 ,ltFRANKLIN FEDERAL TAXFREE INCOME FUND> PAYOUT ,ltFRANKLIN NEW YORK TAXFREE INCOME FUND> PAYOUT ,ltFRANKLIN US GOVERNMENT SECURITIES FUND>PAYOUT ,GM ltGM> UNIT TO OFFER PREAPPROVED CREDIT ,CANADA RULING ON US CORN INJURY DUE THIS WEEK ,FIRST MISSISSIPPI CORP ltFRM> SETS PAYOUT ,ROTTERDAM PORT UNION AND EMPLOYERS TO MEET ,FED SETS 15 BILLION DLR CUSTOMER REPURCHASE FED SAYS
 ,AIRGAS ltAGA> DECLINES TO COMMENT ON STOCK MOVES ,JIM WALTER CORP ltJWC> SETS PAYOUT ,FED ADDS RESERVES VIA CUSTOMER REPURCHASES ,SONY TO EXPAND UK TELEVISION OUTPUT ,JAPANS NTT FORECASTS PROFITS FALL IN 1987/88 ,EC COMMISSION GIVEN PLAN TO SAVE STEEL INDUSTRY ,LONDON STOCK EXCHANGE TO CLOSE TRADING FLOOR ,EAGLE TELEPHONICS ltEGLA> SELLS TELEPHONES ,DUROTEST CORP ltDUR> 2ND QTR JAN 31 NET ,ltFRANKLIN UTILITIES FUND> SETS PAYOUT ,GELCO CORP ltGEL> 2ND QTR JAN 31 NET ,INTERNCHANGE FINANCIAL SERVICES ltISBJ> PAYOUT UP ,KAPOK CORP ltKPK> IN TECHNICAL DEFAULT ,NEWPORT CORP ltNESP> 2ND QTR JAN 31 NET ,KAPOK CORP ltKPK> 1ST QTR DEC 31 LOSS ,PREFERRED HEALTHCARE LTD ltPHCC> 4TH QTR NET ,TRANZONIC COS ltTNZ> SETS QUARTERLY ,NUEUTROGENA ltNGNA> TO BUY BACK STOCK ,CRONUS INDUSTRIES INC ltCRNS> 4TH QTR LOSS ,MERCURY ENTERTAINMENT CORP ltMCRY> YEAR NOV 30 ,CME PLANS RULE CHANGES TIGHTENING S/P TRADING ,BENGUET CORP ltBE> CALENDAR 1986 ,POGO ltPPP> CONSOLIDATES TWO DIVISIONS ,UNOCAL ltUCL> UNIT CUTS CRUDE OIL POSTED PRICES ,PANHANDLES ltPEL> TRUNKLINE REDUCES GAS RATES ,INVESTOR GROUP HAS TALKS WITH PESCH ON AMI ltAMI> ,IMS INTERNATIONAL INC ltIMSI> SETS QUARTERLY ,BANNER ltBNR> COMPLETES TENDER FOR REXNORD ltREX> ,MUTUAL OF OMAHA INTEREST SHARES ltMUO> QTLY DIV ,MOBIL ltMOB> UNIT TO PRODUCE FOOD PACKAGING ,CORRECTED  BANKAMERICA NEGOTIATING UNITS SALE ,OSR ltOSRC> TO MAKE ACQUISITION ,MERCURY ENTERTAINMENT ltMCRY> SEES BETTER RESULTS ,CRONUS INDUSTRIES INC ltCRNS> SELLS UNIT ,UNISYS CORP ltUIS> SETS QUARTERLY ,JACOBSON ltJCBS> VOTES SPLIT INCREASES PAYOUT ,AW COMPUTER ltAWCSA> IN SUPPLY AGREEMENT ,HARLEYDAVIDSON INC ltHDI> 4TH QTR NET ,ltHOECHST AG> COMPLETES CELANESE ltCZ> ACQUISITION ,AMERICUS TRUST ltHPU> EXTENDS DEADLINE ,MORSE SHOE INC ltMRS> 4TH QTR NET ,BENETTON IN FINANCIAL SERVICES JOINT VENTURE ,ICO QUOTA TALKS CONTINUE OUTCOME HARD TO GAUGE ,SEC STAFF ADVISES FRAUD CHARGES AGAINST WPPSS ,PACIFIC WESTERN FUSES MANAGEMENT WITH CP AIR ,AMGEN ltAMGN> TO FORM PARTNERSHIP ,BENETTON IN FINANCIAL SERVICES JOINT VENTURE ,AIBD CEDEL EUROCLEAR JOIN IN TRADE MATCH SYSTEM ,ZAPATA ltZOS> WONT PAY INTEREST ON DEBENTURES ,HARNISCHFEGER INDUSTRIES INC ltHPH> 1ST QTR NET ,IRISH OIL CONCERN HAS 85 PCT OF CYNERGY ltCRG> ,ALCAN ALUMINIUM LTD SETS THREE FOR TWO STOCK SPLIT
