 ,FAMILY HEALTH SYSTEMS INC ltFHSY> 2ND QTR FEB 28 ,CBT NIGHT TRADING SESSION SEEN GETTING APPROVAL ,INTERNATIONAL BUSINESS MACHINES CORP ltIBM> NET ,USAIR ltU> REPORTS FINAL PRORATION FACTOR ,MORE BRITISH GOLD ARTICLES HALLMARKED ,TEXACO ltTX> USES BANKRUPTCY COURT TO BUY TIME ,SWISS SIGHT DEPOSITS FALL 464 BILLION FRANCS ,UK MONEY MARKET GIVEN FURTHER 68 MLN STG HELP ,GOODYEAR ltGT> PREDICTS FIRST QUARTER NET ,TAIWAN ANNOUNCES NEW ROUND OF IMPORT TARIFF CUTS ,CHINA AND PORTUGAL SIGN MACAO DEAL ,HOG AND CATTLE SLAUGHTER GUESSTIMATES ,TRADE ISSUES STRAINING ECS PATIENCE WITH JAPAN ,EC COULD DECIDE ON JAPAN TRADE MOVES IN LATE MAY ,PH GLATFELTER ltGLT> ACQUIRING ECUSTA ,GREENWICH PHARMACEUTICALS COMPLETES PLACEMENT ,NCR CORP 1ST QTR SHR 65 CTS VS 51 CTS
 ,BROWNINGFERRIS ltBFI> UNIT SEES EPA LAWSUIT ,FIRST MARATHON ltFMSATO> PLANS STOCK SPLIT ,US BANCORP ltUSBC> 1ST QTR NET ,IBM ltIBM> HAS HIGHER SHIPMENTS COSTS IN QTR ,ROTTERDAM GRAIN HANDLER SAYS PORT BALANCE ROSE ,LINDBERG CORP ltLIND> 1ST QTR NET ,BELGELECTRIC RAISES 300 MLN LUXEMBOURG FRANCS ,GERMAN INSTITUTES WARN ON MONEY SUPPLY ,NCR CORP ltNCR> 1ST QTR NET ,GERMAN PRODUCER PRICES FALL 01 PCT IN MARCH ,USDA CHANGES LOW PROTEIN WHEAT TERMINAL PRICES ,ALCIDE ltALCDO> SAYS TESTS ENCOURAGING ,TEXACO CANADA ltTXC> UNAFFECTED BY LEGAL MOVE ,FHLBB CHANGES SHORTTERM DISCOUNT NOTE RATES ,GALILEO ELECTROOPTICS CORP ltGAEO> 2ND QTR ,GREAT LAKES FOREST PLANS 390 MLN DLR ONTARIO EXPANSION
 ,BOSTON FIVE ltBFCSO> NEWORLD ltNWORO> TO MERGE ,COOPERVISION ltEYE> FORMS RECAPITALIZATION PLAN ,COLOMBIA JUNE COFFEE REGISTRATIONS OPENED ,US FEDERAL HOME LOAN BANKS SET OFFERING TOTALING 2135 BILLION DLRS
 ,CANADA LEADING INDICATOR UP 04 PCT IN JANUARY AFTER 04 PCT DECEMBER RISE  OFFICIAL
 ,SPANISH MONEY SUPPLY GROWING AT DOUBLE TARGET PACE ,REEBOK INTERNATIONAL LIMITED ltRBK> 1ST QTR ,BLOUNT INC ltBLT> 4TH QTR NET ,UK MONEY MARKET GIVEN LATE HELP OF 210 MLN STG ,GIANT BAY ltGBYLF> IN IDAHO GOLD VENTURE ,BLUE ARROW TO ACQUIRE RICHARDS CONSULTANTS ,MERRYGOROUND ltMGRE> SETS STOCK SPLIT ,ASARCO UPS US LEAD PRICE 050 CT TO 27 CTS ,ENEL ISSUES 15 BILLION YEN EUROBOND ,IRVING BANK CORP 1ST QTR SHR 151 DLRS VS 162 DLRs
 ,SAUDI ARABIA LIBERALISES BANKING SYSTEM ,GENERAL NUTRITION FILES FOR SECONDARY OFFERING OF EIGHT MLN COMMON SHARES
 ,IRVING BANK CORP ltV> 1ST QTR NET ,GENERAL NUTRITION ltGNC> FILES FOR OFFERING ,TEXACO NOT REQUIRED TO POST BOND IN APPEAL OF PENNZOIL JUDGMENT COURT SAYS
 ,OSULLIVAN CORP ltOSL> 1ST QTR NET ,FRENCH 13WEEK TBILL AVERAGE RATE RISES TO 739 PCT FROM 736 PCT  OFFICIAL
 ,PARK COMMUNICATIONS INC ltPARC> 1ST QTR NET ,NVHOMES ltNVH> SETS SPLIT PAYMENT DATE ,DILLARD DEPARTMENT STORES AGREES TO BUY TWO ALLIED STORES UNITS FOR 255 MLN DLRS CASH
 ,CHEMICAL NEW YORK CORP 1ST QTR SHR 158 DLRS VS 193 DLRS
 ,BANKERS TRUST ltBT> RAISES BROKER LOAN RATE ,MOODYS MAY DOWNGRADE IRVING BANK CORP AFFECTS 950 MLN DLRS OF DEBT
 ,PENNZOILltPZL> TO CONTEST TEXACO ltQTX> BANKRUPTCY ,PENTLAND TO REDUCE REEBOK ltRBK> HOLDINGS ,SEARS ROEBUCK SAID IT WILL REDEEM ALL ADJUSTABLE RATE PREFERRED SHARES FIRST SERIES
 ,US HOME LOAN BANKS SET 2135 BILLION DLR OFFER ,CANADA JANUARY LEADING INDICATOR UP 04 PCT ,ltNATIONAL WESTMINSTER BANK PLC> 1ST QTR NET ,IRVING BANK ltV> CITES LOANS IN EARNING DECLINE ,SEARS ltS> TO REDEEM ADJUSTABLE RATE PREFERRED ,GLOBAL LOWERS HEAVY FUELS PRICES ,CHEMICAL NEW YORK CORP ltCHL> 1ST QTR NET ,CCC ACCEPTS BONUS ON CATTLE TO CANARY ISLANDS ,AFG INDUSTRIES INC ltAFG> 1ST QTR NET ,WORK ON GREEK ALUMINA PLANT TO START END MAY ,ltNEW MILFORD SAVINGS BANK> 1ST QTR NET ,COMMONWEALTH ALUMINUM PUTS PLANT ON THE BLOCK ,ALZA CORP ISSUES 75 MLN DLR CONVERTIBLE BOND ,INTERFINCO SETS 50 MLN SFR FIVEYEAR CONVERTIBLE ,S/P DOWNGRADES TEXACOS ltTX> DEBT TO D ,HF AHMANSON AND CO ltAHM> 1ST QTR NET ,DU PONT ltDD> UNIT TO REDEEM NOTES ,BERKEY ltBKY> ELECTS CHAIRMAN RAISES 4 MLN DLRS ,PAKISTAN REPORTEDLY BOUGHT WHITE SUGAR AT TENDER , bank of england to auction up to 325 billion stg in gilts first auction in midmay
 ,EKN BANK SETS 25 MLN SWISS FRANC WARRANT BOND ,MOODYS MAY DOWNGRADE THREE FRENCH BANKS ,FED EXPECTED TO SET THREEDAY REPURCHASE PACTS ,ALLIED STORES ltALS> SELLS DILLARD ltDDS> TWO UNITS ,TEXACO ltQTX> NOT REQUIRED TO POST BOND ,CBT MMI STOCK INDEX FUTURES TO EXPIRE THURSDAY ,HUGHES US RIG COUNT DOWN THREE THIS WEEK ,NCR ltNCR> CONTINUES TO EXPECT EARNINGS GROWTH ,GENETICS INSTITUTE INC ltGENIO> 1ST QTR LOSS ,PRIME COMPUTER ltPRM> TO INTRODUCE NEW MACHINES ,ENTRE COMPUTER ltETREO> CLOSING OVERSEAS UNITS ,MOODYS MAY DOWNGRADE IRVING ltV> DEBT ,ITALYS BANCA COMMERCIALE TO LAUNCH EUROLIRE BONDS ,ENTRE COMPUTER CENTERS INC ltETRE> 2ND QTR LOSS ,MERRILL LYNCH ltMER> INVESTMENT REVENUES UP ,DSC COMMUNICATIONS ltDISIO> AMENDS SUPPLY PACT ,WOODWARD AND LOTHROP PRESIDENT RESIGNS ,STANDARD MICROSYSTEMS CORP ltSMSCO> 4TH QTR NET ,PENNSYLVANIA REAL ESTATE INVESTMENT TRUST ltPEI> ,ALLWASTE INC ltALWSO> 2ND QTR FEB 28 ,COMBUSTION ENGINEERING ltCSP> IN SYSTEMS PACT ,SCOTT AND STRINGFELLOW ltSCOTO> 3RD QTR MAR 31 ,GENERAL NUTRITION ltGNC> SHARES TO BE SOLD ,WALL STREET STOCKS/TEXACO ltQTX> PENNZOIL ltPZL> ,JOHN MOWLEM ARRANGES 50 MLN STERLING CP PROGRAM ,FOSTER ltFWC> UNIT AUDIT REVEALS DISCREPANCIES ,THE HAGUE LAUNCHES SECOND TRANCHE OF CP PROGRAM ,HUGHES CANADA RIG COUNT DOWN 19 THIS WEEK ,TAIWAN ANNOUNCES NEW ROUND OF IMPORT TARIFF CUTS ,US JUNK BONDS UNAFFECTED BY TEXACO ltTX> FILING ,BULGARIA ROMANIA GRAIN CROP SEEN LESS FAVORABLE ,ELCOR CORP ltELK> 3RD QTR MARCH 31 ,CAPITAL MARKET BORROWING FALLS IN MARCH OECD SAYS ,SAUDI ARABIA BUYS RBD PALM OLEIN ,ABINGTON SAVINGS BANK ltABBKO> 1ST QTR NET ,GREAT LAKES ltGLTO> IN 390 MLN DLR EXPANSION ,BANKING CENTER ltTBCX> 1ST QTR NET ,SOVIET TANKERS SET TO CARRY KUWAITI OIL ,CHEMICAL ltCHL> NET HURT BY BRAZIL EXPENSES ,CAPITAL MARKET BORROWING FALLS IN MARCH OECD SAYS ,GENETICS ltGENIO> SEES HIGHER 87 LOSSES ,INVESTOR BOOSTS TRANSLUX ltTLX> STAKE ,SOLITRON DEVICES INC ltSOD> 4TH QTR NET ,US TRUST CORP FIRST QTR SHR 88 CTS VS 83 CTS
 ,NATIONAL COMPUTER ltNLCSO> TO BUY SHARES ,PEOPLES HERITAGE BANK ltPHBK> 1ST QTR NET ,AMERITECH ltAIT> MICHIGAN UNIT TO LOWER RATES ,STUART HALL CO INC ltSTUHO> 1ST QTR FEB 28 NET ,CLAYTON HOMES INC ltCMH> 3RD QTR MARCH 31 NET ,COMMAND AIRWAYSltCOMDO> MARCH LOAD FACTOR RISES ,SWIFT TO SELL SOUTH DAKOTA PORK PLANT ,US TRUST CORP ltUSTCO> 1ST QTR NET ,PRIMARY GILTS DEALERS NEED NOT BUY AT AUCTIONS ,GULF OF MEXICO RIG COUNT DOWN SLIGHTLY THIS WEEK ,FED ADDS RESERVES VIA CUSTOMER REPURCHASES ,BURROUGHSWELLCOME SETS RESEARCH SPENDING ,DESPTP OMC ltDSO> 1ST QTR NET ,PARK COMMUNICATIONS INC ltPARCO> 1ST QTR MAR 31 ,SOFTWARE SERVICES ltSSOA> EXTENDS WARRANTS ,FEDERAL GUARANTEE CORP ltFDGCO> 1ST QTR NET ,BACHE SECURITIES SETS NAME CHANGE EXPANSION ,ANGELL CARE MASTER LP ltACR> RAISES QUARTERLY ,CHARTERHOUSE GETS 310 MLN DLRS IN NEW CAPITAL ,FRANKLIN MICHIGAN INSURED SETS LOWER PAYOUT ,FRANKLIN HIGH YIELD SETS HIGHER PAYOUT ,FRANKLIN PENNSYLVANIA TAXFREE IN INITIAL PAYOUT ,GENERAL PARTNERS SELLS GENCORP ltGY> STAKE ,FRANKLIN PENNSYLVANIA US SETS INITIAL PAYOUT ,DUFF/PHELPS DOWNGRADES MELLON BANK CORP ltMEL> ,GAF ltGAF> STUDYING BORGWARNER ltBOR> PLAN ,NATIONAL WESTMINSTER BANK USA 1STQTR NET RISES ,LASER PHOTONICS INC ltLAZRO> 4TH QTR DEC 31 ,EASTERN UTILITIES ASSOCIATES ltEUA> UPS PAYOUT ,ITALYS BUITONI ACQUIRES VISMARA FOOD GROUP ,MCGRAWHILL ltMHP> DIVESTS SOUTH AFRICAN UNIT ,OAK ONDUSTRIES ltOAK> TO BUY ELECTRONICS FIRM ,PEOPLES HERITAGE BANK ltPHBK> 1ST QTR NET ,REVLON GROUP AGREES TO MERGE WITH MACANDREWS AND FORBES GROUP FOR 2010 DLRS/SHR CASH
 ,US TRUST CO ltUSTC> RAISES BROKER LOAN RATE ,FIRESTONE ltFIR> IN AGREEMENT WITH CHAIRMAN ,CORRECTEDCRAZY EDDIE ltCRZYO> SETS RIGHTS ,BIOTECH ELECTRONICS INC ltIONTO> 3RD QTR NET ,TEXSCAN TO FILE REORGANIZATION PLAN ,NOMURA REPACKAGES DANISH ISSUE AS ZEROCOUPON BOND ,RHONEPOULENC PLANS DRUG RESEARCH SPENDING ,TEXACO NETHERLANDS UNAFFECTED BY CHAPTER 11 FILING ,PORTUGUESE CONSUMER PRICES UP 14 PCT IN MARCH ,DEST ltDESTO> EXPECTS HIGHER 4TH QTR SALES ,MYERS INDUSTRIES INC ltMYE> 1ST QTR NET ,GTE CORP 1ST QTR SHR 78 CTS VS 86 CTS
 ,RESDEL ltRSDLO> TO MERGE WITH SAN/BAR ltSBARO> ,MIDLANTIC ltMIDLO> TO ACQUIRE COUNTY BANCORP ,PEOPLES SAVINGS BANK OF BROCKTON ltPBKBO> ,MICRO GENERAL CORP ltMGENO> 4TH QTR LOSS ,US AUTOWORKERS SET FOR TOUGH BARGAINING ROUND ,GTE CORP ltGTE> 1ST QTR MAR 31 ,MITEL ltMLT> HAS TWO NEW PRODUCTS ,GTE POSTS PRETAX LOSS OF 121 MLN DLRS IN 1ST QTR FOR 50 PCT SHARE OF US SPRINT
 ,GROUP RAISES SCANDINAVIA FUND ltSCF> STAKE ,SQUARE D CORP ltSQD> 1ST QTR NET ,TRITON ltOIL> SAYS PARIS BASIN RESERVES UP 39 PCT ,TALKING POINT/IBM ltIBM> ,SUNCOOK BANK MEETING ENJOINED BY COURT ORDER ,MICRO MASK INC ltNMSO> 2ND QTR MAR 31 OPER LOSS ,JAPANESE CRUSHERS BUY CANADIAN RAPESEEED ,IRVING BANK ltV> 1STQTR NET HURT BY BRAZIL ,ALZA ltAZA> PLANS DEBENTURE OFFERING ,MORGAN STANLEY ISSUES WARRANTS INTO JAPANESE FIRM ,ALLEGHENY/WESTERN ENERGY ltALGHO> UPS PAYOUT ,STANDARD ltSRD>MOBIL ltMOB>PLAN OFFSHORE PLATFORM ,MOODYS DOWNGRADES TEXACOS 82 BILLION DLRS OF DEBT TO CAA
 ,UNITED TELECOMMUNICATIONS INC 1ST QTR SHR 13 CTS VS 47 CTS
 ,ltCOAST RV INC> 1ST QTR NET ,US FEBRUARY TRADE TO BE REPORTED ON NEW BASIS ,REVLON ltREV> AND MACANDREWS AND FORBES TO MERGE ,REAL ESTATE FIRM CUTS INTERMAGNETICSltINMA> STAKE ,DATA TECHNOLOGY SETS INITIAL STOCK OFFERING ,DHL WORLDWIDE EXPRESS BROADENS NETWORK ,USG ltUSG> TO ASK INCREASE IN AUTHORIZED SHARES ,FIRST COMMERCE CORP ltFCOM> 1ST QTR NET ,DATAPRODUCTS ltDPC> TO BUY IMAGING SOLUTIONS ,JANNOCK ltJNTO> ACQUIRES HALFSTAKE IN PRINTER ,PRESIDENTIAL AIRWAYS ltPAIRO> UNIT ADDS SERVICE ,NORTHERN TRUST ltNTRSO> FILES SHELF ,NORTHERN TRUST ltNRTS> FILES FOR SHELF DEBT ,MARK IV INDUSTRIES INC ltIV> 4TH QTR FEB 28 NET ,PACIFIC NUCLEAR SYSTEMS ltPACNO> WINS CONTRACT ,AEQUITRON ltAQTN> WRONGFUL DEATH SUIT DISMISSED ,ELECTROHOME ltELXTO> TO SELL UNIT ,SALICK HEALTH CARE INC ltSHCIO> 2ND QTR NET ,LASER PHOTONICS INC ltLAZRO> CLOSES SALE ,AMSOUTH BANCORP ltASO> SETS EXCHANGE RATIO ,VOPLEX CORP ltVOT> 1ST QTR MAR 31 ,ROYAL PALM SAVINGS ltRPALO> NAMES PRESIDENT ,HADSON CORP ltHADSO> COMPLETES ACQUISITION ,HUGH KEITH ltHKMEO> COMPLETES ACQUISITION ,ARRAYS ltARAY> COMPLETES MERGER ,CONSUL ltCNSLO> EXTENDS EXCHANGE DEADLINE ,MICHAEL FOODS NAMES PRESIDENT ,FRANKLIN MASSACHUSETTS SETS MONTHLY PAYOUT ,FRANKLIN MINNESOTA SETS MONTHLY PAYOUT ,FRANKLIN INSURED SETS MONTHLY PAYOUT ,FRANKLIN OHIO SETS MONTHLY PAYOUT ,FRANKLIN PUERTO RICO SETS MONTHLY PAYOUT ,FRANKLIN CALIFORNIA SETS MONTHLY PAYOUT ,BANK OF ENGLAND TO MONITOR WHENISSUED TRADING ,CANADA STOCKS/DOME PETROLEUM LTD ltDMP> ,UNITED TELECOMMUNICATIONS INC ltUT> 1ST QTR NET ,HOECHST PLANS OFFERING TO FINANCE MERGER DEBT ,FIRST PENNSYLVANIA CORP ltFPA> 1ST QTR NET ,ltCLARK COPY INTERNATIONAL> BUYS W GERMAN STAKE ,ENTRE COMPUTER CENTERS INCltETREO> 2ND QTR LOSS ,GTE ltGTE> CITES LOSS OF SPRINT ,PENN PACIFIC ltPPACO> TO SELL DEBT OUTSIDE US ,GOODYEAR ltGT> TO SELL CELERON ,PROPOSED OFFERINGS RECENTLY FILED WITH THE SEC ,BANKAMERICA ltBAC> NAMES NEW GROUP VICE CHAIRMAN ,NEW ENGLAND SAVINGS BANK ltNESB> 1ST QTR NET ,AMERICAN NATIONAL CORP ltFNB> 1ST QTR NET ,AB ASTRA SHARE SPLIT TO WIDEN FOREIGN OWNERSHIP ,CHAMBERS DEVELOPMENT ltCDV> SIGNS PACT ,CORRECTEDltNATIONAL WESTMINSTER BANK USA>1ST QTR ,TURKEY SEEN UNLIKELY TO JOIN EC THIS CENTURY ,THE ONE BANCORP ltTONE> 1ST QTR NET ,NORQUEST ltNQRLF> MAKES BID FOR NORTHAIR ltNRMTO> ,MORGAN STANLEY ISSUES WARRANTS INTO JAPANESE FIRM ,ARISTECH ltARS> SAYS 1ST QTR SHR ESTIMATE RIGHT ,UNITED TELECOM ltUT> REPORTS US SPRINT LOSS ,ITALYS BNL SIGNS ACCORD WITH TWO SOVIET BANKS ,APOLLO COMPUTER ltAPCIO> IN PACT WITH INFERENCE ,CANADA APPROVES US GAS EXPORTS BY PROGAS ,TEXACOS ltTX> DEBT DOWNGRADED TO CAA BY MOODYS ,DOLLAR STRAIGHT BONDS END LOWER TEXACO UNTRADED ,BRAND COMPANIES ltBRAN> SEES FIRST QUARTER LOSS ,CANADA POPULATION GROWTH SLOWEST IN 25 YEARS ,TURKEY SEEN UNLIKELY TO JOIN EC THIS CENTURY ,US FEBRUARY TRADE TO BE REPORTED ON NEW BASIS ,FISCHERWATTS HORIZON GOLD ltHRIZO> TEST MINE ,GATT STAFF STRIKE OVER PAY AND PENSION LOSSES ,EUROCAPITAL ltEUROO> SEEKS TO MARKET CONDOMS ,MARYLAND NATIONAL ltMDNT> FILES TO OFFER NOTES ,BOOTHE ltBCMPO> MAKES ACQUISITION ,GATT STAFF STRIKE OVER PAY AND PENSION LOSSES ,ATLANTIC FINANCIAL ltATLFO> TO ACQUIRE S AND L ,GAF ltGAF> SEEN RAISING BORGWARNER ltBOR> BID ,AMEX STARTS TRADING AMERICAN BUSINESSPHONES ltAB> ,FOOTHILL GROUP ltFGI> COMPLETES DEBT PLACEMENT ,OSICOM TECHNOLOGIES IN INITIAL PUBLIC OFFERING ,PERSONAL COMPUTER PRODUCTS ltPCPIO> PLACES DEBT ,PUEBLO INTERNATIONAL INC ltPII> SETS PAYOUT ,SWIFT ltSFTPF> TO SELL SOUTH DAKOTA PORK PLANT ,SIMMONS ltSIMMO> MARCH LOAD FACTOR DECLINES ,ltGEN TERM CORP> ACQUIRES PRIVATE FIRM ,ltC AND R CLOTHIERS INC> JAN 31 YEAR NET ,CCX NETWORK ltCCXN> TO MAKE ACQUISITION ,MEDICAL IMAGING ltMIKAO> LP PLANS OFFER ,US CORN EXPORTS SEEN WELL AHEAD OF LAST YEAR ,NWA ltNWA> AIRLINE ADDS TRANSPACIFIC FLIGHT ,PERSONAL COMPUTER PRODUCTS ltPCPIO> EXPECTS LOSS ,FLEXIBLE ltFLXXO> IN GENERAL DYNAMICS ltGD> ORDER ,ltSCANGRAPHICS INC>IN MCDONNELL DOUGLASltMD> PACT ,GREAT NORTHERN NEKOOSA FIRST QTR SHR 159 DLRS VS 54 CTS
 ,GANDER ltGNDRO> BUYS WESTERN WEAR RETAILER ,PAULEY PETROLEUM ltPP> NAMES NEWGARD PRESIDENT ,GREAT NORTHERN NEKOOSA ltGNN> 1ST QTR NET ,AIRSHIP ltAIRSY> GETS JAPANESE CONTRACT ,DIGILOG ltDIOL> GETS BELLSOUTH ltBSC> ORDERS ,TRACOR ltTRR> GETS LOCKHEED ltLK> CONTRACT ,BELL ATLANTIC ltBEL> UNIT IN DISTRIBUTION DEAL ,AMERICAN HEALTH PROPERTIES INC ltAHE> 1ST QTR ,WELLS FARGO AND CO 1ST QTR SHR 136 DLRS VS 113 DLRS
 ,WORLD BANK PRESIDENT OPPOSES DEBT FORGIVENESS ,CBT TNOTE OPTIONS SET VOLUME RECORD ,IRAN SAYS IT ACHIEVED OBJECTIVE IN BASRA OFFENSIVE ,ARGENTINA SAYS NEAR DEAL WITH CREDITOR BANKS ,ELECTION RESULT MAY DELAY JAPAN ECONOMIC STIMULUS ,WELLS FARGO AND CO ltWFC> 1ST QTR NET ,COMERICA INC ltCMCAO> 1ST QTR NET ,UNICLUB IN JOINT VENTURE ,WORLD AIRWAYS ltWOA> LAYS OFF 103 MORE EMPLOYEES ,CHAMPION PRODUCTS ltCH> SETS PAY DATE FOR SPLIT ,SHULTZ BEGINS ARMS TALKS WITH SHEVARDNADZE ,SPEARHEAD INDUSTRIES INC ltSPRHO> 3RD QTR NET ,AMEX STARTS TRADING LAWRENCE INSURANCE ltLWR> ,GUY F ATKINSON CO ltATKNO> UNIT WINS CONTRACT ,KDI CORP ltKDI> 1ST QTR MARCH 31 ,RJ NABISCOS ltRJR> UNIT SELLS CIGAR BUSINESS ,CORRECTEDCRAZY EDDIE ltCRZY> EXECUTIVE OFF BOARD ,GUINNESS PEAT ORDERS CFM ENGINES FOR AIRBUS A320 ,FIRMS ASK EXEMPTIONS FROM JAPANESE TARIFFS ,CENTRAL BANKERS HOLDS REGULAR BIS MONTHLY MEETING ,DIGITAL EQUIPMENT ltDEC> TO REDEEM DEBENTURES ,SOFTWARE SERVICES OF AMERICA INC ltSSOAO> NET ,TECHNOLOGY/COMPETITION FOR SATELLITE ,GANDER MOUNTAIN ltGNDRO> BUYS WESTERN WEAR FIRM ,EC MEAT DIRECTIVE DEADLINE SEEN FLEXIBLE ,US BANKS LIKELY TO LIFT PRIME RATES AGAIN SOON ,BANKAMERICA ltBAC> SETS NEW BANKING SERVICE ,US OFFICIALS SAY NO PROGRESS ON JAPAN DISPUTE ,HEALTH AND REHABILITATION ltHRP> SETS FIRST DIVI ,UTAH POWER AND LIGHT CO ltUTP> 1ST QTR NET ,ERICSSON ltERICYO> TO BUY REST OF SPANISH UNIT ,ITS DEVELOPS INTERACTIVE VIDEO SYSTEMS ,INSITUFORM ltIGLSFO> RAISES WARRANT EXERCISE PRICE ,PICTEL CORP ltPCTLO> CHANGES NAME ,COMPUTRAC ltLLB> SEES LOWER FIRST QUARTER NET ,DATAPOINT ltDPT> NAMES NEW EXECUTIVES ,ltHITECH ENGINEERING CO> WINS JUDGMENT ,NOVA ltNVAATO> NOT PLANNING DOME ltDMP> BID ,FEDERAL COURT DISMISSES FMC CORPS INSIDER TRADING SUIT AGAINST IVAN BOESKY COURT CLERK SAYS
 ,DONALDSON LUFKIN JENRETTE SUED BY SWISS FIRM ,PIEDMONT AVIATION ltPIE> FREIGHT TRAFFIC UP ,EXXON ltXON> EXTENDS MIDGRADE UNLEADED MARKETING ,FIBERCOM TO INSTALL FIBEROPTIC DATA NETWORK ,ltFIRST MONTAUK SECURITIES> IN MERGER DEAL ,BARNETT BANKS OF FLORIDA INC ltBBF> 1ST QTR NET ,GOLDEN WEST FINANCIAL CORP ltGDW> 1ST QTR NET ,S/P KEEPS BORGWARNER ON CREDITWATCH ,HONEYWELL INC ltHON> 1ST QTR OPER NET ,WALL STREET STOCKS/BROWNING FERRIS ltBFI> ,HOMESTAKE ltHM> MULLS BUYING ORE RESERVES ,CHRONAR CORP ltCRNRO> YEAR LOSS ,EMPIRE ltEMPATO> TO BUY SOBEYS ltSYSATO> STOCK ,INTERNATIONAL RESEARCH ltIRDV> 1ST QTR NET ,BROOKLYN UNIONS ltBU> UNIT TO EXPAND DRILLING ,MOODYS MAY UPGRADE BELL ATLANTIC ltBEL> UNIT ,CANADA PLANS THREEPART ONE BILLION DLR BOND ISSUE TUESDAY  OFFICIAL
 ,COURT DISMISSES FMC ltFMC> SUIT AGAINST BOESKY ,CORRECTED  GOODYEAR ltGT> TO SELL CELERON ,INTL RESEARCH/DEVELOPMENT ltIRDVO> 1ST QTR NET ,BANK OF NEW ENGLAND CORP 1ST QTR SHR 104 DLRS VS 83 CTS
 ,HONEYWELL ltHON> CITES COST CUTTING FOR GAIN ,CCC CREDIT GUARANTEES FOR RICE TO ALGERIA  USDA ,MGM/UA COMMUNICATIONS ltMGM> 2ND QTR FEB 28 LOSS ,ltSPENCER COS> SUES CHASE MANHATTAN ltCMB> ,HOMESTAKE MULLS BUYING ORE RESERVES ,BELL ATLANTIC ltBEL> UNIT TO SELL SERVICES GEAR ,INTERFIRST CORP 1ST QTR LOSS 28 CTS VS PROFIT THREE CTS
 ,KUWAITI DAILY SAYS OPEC CREDIBILITY AT STAKE ,WILLAMETTE INDUSTRIES ltWMTT> 4TH QTR NET ,HUTTON ltEFH> NAMES PERAS SENIOR VP ,MARINE MIDLAND BANKS INC 1ST QTR 174 DLRS VS 189 DLRS
 ,AMERICAN CENTURY ltACT> RESTATES EARNINGS ,CANADA PLANS ONE BILLION DLR BOND ISSUE ,CANADIAN IMPERIAL CONSIDERS BRAZIL LOAN STATUS ,SOUTHERN UNIT ltSO> RATINGS AFFIRMED BY MOODYS ,INTERFIRST CORP ltIFG> 1ST QTR LOSS ,COMPUTER ltCPTLAO> FOUNDER RESIGNS ,AMERICAN EXCHANGE ELECTS 10 BOARD MEMBERS ,CLEVITE ltCLEVO CITES 96 MLN DLR DEBT ,MARINE MIDLAND BANKS INC ltMM> 1ST QTR NET ,NL INDUSTRIES ltNL> NAMES PRESIDENT ,ltFOURTH NATIONAL CORP> STAKE ACQUIRED ,DEL WEBB ltWBB> UNIT SELLS JOINT VENTURE STAKE ,BANK OF NEW ENGLAND CORP ltBKNEO> 1ST QTR ,US EXPORTERS REPORT 350000 TONNES CORN SOLD TO UNKNOWN DESTINATIONS FOR 1986/87
 ,CANANDAIGUA WINE CO INC ltCDGA> 2ND QTR NET ,US TRADE PANEL RULES AGAINST BRAZILIAN  ORANGE JUICE IMPORTS WILL IMPOSE DUTUES
 ,FLORIDA PROGRESS CORP ltFPC> 1ST QTR NET ,TRIBUNE ltTRB> TO BUY HOLLYWOOD PROPERTY ,US AGENCY RULES AGAINST BRAZIL ORANGE JUICE ,TALKS FAIL TO HEAD OFF CHIP SHOWDOWN WITH JAPAN ,BIONUTRONICS ltBNUIO> MAY CEASE OPERATIONS ,NATIONAL CITY BANCORP ltNCBMO> 1ST QTR NET ,MORTON THIOKOL ltMTI> WANTS PAPERS MADE PUBLIC ,ONEOK INC ltOKE> 2ND QTR FEB 28 NET ,TEXACO ltTX> SAYS SOME OIL FLOWS REESTABLISHED ,TEXAS AIR ltTEX> UNIT HIKES SERVICE FROM DENVER ,NATIONAL CITY BANCORP ltNCBMO> 10 PCT DIVIDEND ,GAMING AND TECHNOLOGY ltGATIO> PRESIDENT RESIGN ,MOODYS MAY DOWNGRADE TRANSCANADA PIPELINE ltTRP> ,FLAGLER BANK CORP ltFLGLAO> 1ST QTR NET ,NATIONAL CITY CORP ltNCTYO> 1ST QTR NET ,RULES CHANGE RAISES CHRYSLER ltC> PENSION COSTS ,BANK OF NEW ENGLAND ltBKNEO> POST PRO FORMA NET ,BURNHAM AMERICAN PROPOERTIES ltBAPYZO> 2ND QTR ,CANADAS WILSON HAS NO COMMENT ON DOME DMP ,INTERNATIONAL TELECHARGE LAUNCHES SERVICE ,DAUPHIN DEPOSIT ltDAPN> TO ACQUIRE COLONIAL ,KUWAITI DAILY SAYS OPEC CREDIBILITY AT STAKE ,TREASURY BALANCES AT FED FELL ON APRIL 9 ,DOE RESOLVES ISSUES WITH ROYAL DUTCH ltRD> UNIT ,CELLULAR COMMUNICATIONS ltCOMMO> CLOSES BUYOUT ,ATHLONE INDUSTRIES INC ltATH> SETS QTLY DIVIDEND ,FIRST FEDERAL SAVINGS BANK ltFFSDO> 2ND QTR NET ,PLANTRONICS INC ltPLX> 3RD QTR MARCH 28 NET ,GAF ltGAF> SEEKS INFORMATION ON BORGWARNERltBOR> ,BELL ATLANTIC ltBEL> UNIT HAS MARKETING APPROVAL ,ABU DHABI MARKETING SAID NOT BREACHING OPEC PACT ,UNITED TECHNOLOGIES GETS 5021 MLN DLR CONTRACT ,LOCKHEED ltLK> UNIT GETS 275 MLN DLR CONTRACT ,COREMARK ltCMKTO> SEES PROBLEM CORRECTION ,RHNB CORP ltRHNB> 1ST QTR NET ,KRAFT ltKRA> COMPLETES ACQUISITION ,FIRST OF AMERICA BANK INC ltFABKO> 1ST QTR NET ,LOMAK PETROLEUM INC ltLOMKO> YEAR LOSS ,US SELLS 3MO BILLS AT 598 PCT STOP 599 PCT 6MO 608 PCT STOP 610 PCT
 ,NEWMONT ltNEM> STAKE IN DU PONT ltDD> DECLINES ,BANKEAST CORP ltBENHO> 1ST QTR NET ,GENERAL MOTORS ltGM> GETS 97 MLN DLR CONTRACT ,UST CORP ltUTSBO> 1ST QTR NET ,FARM EQUIPMENT SALES DECLINE IN MARCH ,CENTRAL ILL PUBLIC SERVICE ltCIP> 1ST QTR NET ,VERSAR ltVSR> HAS US AIR FORCE CONTRACT ,BRASCAN LTD ltBRSA> TO REDEEM PREFERREDS ,ltTHERACARE INC> TO ACQUIRE CUSHING ,INTERCO ltISS> COMPLETES LANEltLANE> ACQUISITION ,HMO AMERICA ltHMOA> AGREES TO BE ACQUIRED ,EVEREST AND JENNINGS ltEJA> QTLY DIVIDEND ,PS GROUP INC ltPSG> QTLY DIVIDEND ,DOME ltDMP> BENEFITS FROM TAKEOVER SPECULATION ,US BILL AUCTION RATES AVERAGE 598 608 PCT ,ANDOVER WAGES HBO ltHBOC> PROXY WAR ,UNITED TECHNOLOGIES ltUTX> IN JOINT PACT ,GROUP RAISES COMPUTER MEMORIES ltCMIN> STAKE ,HONG KONG FIRM HAS 51 PCT OF MCGILL ltMGLLO> ,RAMADA ltRAM> SELLS SUBORDINATED NOTES ,MONTGOMERY STREET INCOME ltMTS> 1ST QTR NET ,NORTHAIR ltNRMTO> OPPOSING NORQUEST ltNQRLF> BID ,VISTA CHEMICAL ltVC> IN PUBLIC OFFERING ,HARMON INDUSTRIES ltHRMNO> IN PACT WITH AMTRAK ,GE ltGE> VENTURE WINS JET ENGINE ORDER ,MEDIZONE SAYS AIDS THERAPY TO BE TESTED ,TEXTRON ltTXT> VICECHAIRMAN RESIGNS ,SEC TO PROBE TWO CONVICTED OF SECURITIES FRAUD ,TEXAS AIR ltTEX> UNIT COMPLETES SYSTEM SALE ,AANCOR UNIT SELLS PRIORITY SUBORDINATED NOTES ,MOODYS DOWNGRADES MICHIGAN GENERAL ltMGL> DEBT ,NCNB CORP ltNCB> 1ST QTR NET ,AIR CANADA SETS SERVICE TO EGYPT ,INVESTMENT FIRM HAS 53 PCT OF BLASIUS ltBLASO> ,CANADA MINISTER SETS REVIEW OF ENERGY OPTIONS ,DUPONTS ltDD> CONOCO SAYS NO INTEREST IN DOME ,FIRST FAMILY GROUP ltFFAM> SALES INCREASE ,BECHTEL INC SETS UTLITY DESIGN CONTRACT ,ISC SYSTEMS ltISCSO> 3RD QTR MARCH 27 NET ,SLATER ltSSIATO> PLANS US MODERNIZATION ,ADAMSRUSSELL ltAAR> TO ACQUIRE CABLE SYSTEMS ,INDEPENDENT BANK CORP ltIBCPO> 1ST QTR NET ,MEDIRX ltMDRXO> NAMED IN ARBRITRATION REQUEST ,GULF CANADA ltGOC> ACQUIRES SUEZ OIL STAKE ,CONVERGENT TECHNOLOGIES ltCVGTO> SEES QTR LOSS ,HEILEMAN ltGHB> ACQUIRING C SCHMIDT TRADEMARKS ,TEXACO ltTX> LESS WILLING TO SETTLE  ANALYSTS ,INTERCO ltISS> SHAREHOLDERS APPROVE MERGER ,JOHN H HARLAND CO ltJH> 1ST QTR NET ,PACIFICORP ltPPW> REDEEMS PREFERRED STOCK ,ltTRAVELERS REALTY INCOME INVESTORS> 1ST QTR NET ,DOTRONIX INC ltDOTXO> TO BUY ltVIDEO MONITORS> ,DEVELCON ELECTRONICS LTD ltDLCFF> 2ND QTR LOSS ,ADVANCED INSTITUTIONAL ltAIMSO> IN NEW FACILITY ,GENETIC LABORATORIES ltGENLO> SETS UP UNIT ,DRESSER INDUSTRIES ltDI> LOSES PATENT APPEAL ,TEXACO FILING ADDS UNCERTAINTY IN OIL MARKET ,ERC INTERNATIONAL ltERC> TO OFFER DEBENTURES ,VALLEY NATIONAL CORP ltVNCPO> 1ST QTR NET ,OTTER TAIL POWER CO ltOTTRO> SETS DIVIDEND ,MERRILL TO GET 30 MLN DLR FEE IN BORG ltBOR> DEAL ,SUPERMARKETS GENERAL ltSGL> UNIONS WANT SECURITY ,PARADYNE ltPDN> IN PACT WITH UNIVAR ltUVX> UNIT ,WHITE HOUSE SAYS SHULTZ TRIP MAY LEAD TO SUMMIT ,PENNZOIL ltPZL> PLOTS STRATEGY TO FIGHT TEXACO ,LATEST BRITISH POLL HAS THATCHER STILL WAY AHEAD ,TEXACO ltTX> PENNZOIL ltPZL> WIDE APART ON ACCORD ,CHRYSLER ltC> NONPROFIT GROUP SELLS UNIT ,POTLATCH CORP ltPCH> 1ST QTR NET ,DENSEPAC MICROSYSTMS ltDPACO> NAMES CEO ,DICEON ELECTRONICS ltDICNO> TO BUY SYMTRON CORP ,ADVANCED GENETIC SCIENCES ltAGSIO> FROSTBAN TEST ,ECUADOR SAYS WILL RESUME LIMITED OIL PRODUCTION ,NEW ZEALAND CPI RISES 23 PCT IN MARCH QUARTER ,LATEST POLL PUTS THATCHERS CONSERVATIVES AHEAD ,COLOMBIAS TEXACO ltTX> OPERATIONS NOT AFFECTED ,Bank of Japan intervenes to support dollar after Tokyo opening dealers
 ,BANK OF JAPAN INTERVENES IN TOKYO AFTER OPENING ,MIYAZAWA SEES EVENTUAL LOWER US TRADE DEFICIT ,Japan March wholesale prices rise 02 pct 01 pct February drop  official
 ,NO TALKS SET ON PROPOSED JAPAN TELECOM MERGER ,CME MEMBERS REJECT PETITION TO BAN DUAL TRADING ,HAITIAN CANE PLANTERS PROTEST SUGAR MILL CLOSURE ,CHINA TO OPEN FIRST PHASE OF LARGE ALUMINIUM PLANT ,TAIWAN IMPORTS 210000 TONNES SOUTH AFRICAN MAIZE ,TAIWAN LIKELY TO BUY MORE US SOYBEANS ,CHINA FACES EXTENDED SORGHUM SHORTAGE ,Bank of Japan intervening to support dollar against yen dealers
 ,JAPAN MARCH MONEY SUPPLY RISES 90 PCT ,ASIA GENERALLY WELCOMES US NIGHT FUTURES TRADING ,Tokyo stock index rises 6992 to record closing 2393835  brokers
