 ,ECONOMIC SPOTLIGHT  EMS MARKS EIGHTH BIRTHDAY ,INDAL UNIT HAS CARIBBEAN WIND TURBINE CONTRACT ,INTERMAGNETICS GENERAL ltINMA> COMPLETES BUY ,CLEVITE ltCLEV> FORMS JOINT VENTURE ,ITALYS FERRUZZI TAKES OVER SPANISH MILL ,AMEX ADDS WYSE TECHNOLOGY ltWYSE> OPTIONS ,CCC ACCEPTS BID FOR DAIRY CATTLE TO KUWAIT ,ITT ltITT> OFFERS LONG DISTANCE WATS SERVICE ,ltAMERICAN HOECHST CORP> YEAR NET ,NEWS CORP ltNWS> UNIT TO OFFER STOCK REDEMPTION ,FED EXPECTED TO SET CUSTOMER REPURCHASES ,IRAN PROBERS AGREE ON IMMUNITY FOR POINDEXTER ,US VIDEO VENDING ltVVCO> MAY FILE BANKRUPTCY ,LEVITT CORP ltLVT> 4TH QTR NET ,EEP SHOULD BE USED TACTICALLY YEUTTER SAYS ,NATIONAL PIZZA ltPIZA> CORRECTS FIGURE ,TBG HOLDINGS NV ltTGBNAS> 1986 YEAR NET ,AVAQ INTERNATIONAL TO SEEK COMMITMENT ON DEAL ,SPAIN TO RELAX EXCHANGE CONTROLS ,RYAN HOMES ltRYN> CALLS DEBENTURES ,STANDARD PRODUCTS CO ltSTD> RAISES QUARTERLY ,AARON SPELLING PRODUCTIONS INC ltSP> 2ND QTR NET ,COOPER LASERSONICS INC ltZAPS> 1ST QTR LOSS ,DIVERSIFIED INDUSTRIES ltDEI> 1ST QTR OPER NET ,S/P DOWNGRADES DENMARKS 176 BILLION US DLRS OF LONGTERM EXTERNAL DEBT
 ,AMSTERDAM LAUNCHES 300 MLN GUILDER CP PROGRAM ,HOECHST CELANESE SETS EXPANSION PROGRAM ,GOLDEN NUGGET INC ltGNG> 4TH QTR LOSS ,OPPENHEIMER INDUSTRIES ltOPP> SEES YEAR LOSS ,BFCE ISSUES THREE BILLION FRANC DOMESTIC BOND ,S/P DOWNGRADES KINGDOM OF DENMARK ,LUBYS CAFETERIAS INC ltLUB> 2ND QTR FEB 28 NET ,US SENATE HOUSE BUDGET CHIEFS AGREE ON TAX ,GM ltGM> PPG ltPPG> SIGN AUTO PAINT PACT ,TESCO FORECASTS PROFITS RISE THIS YEAR ,ADDISONWESLEY ltADSN> LICENSES SOFTWARE PRODUCT ,BUSINESS COMPUTER ltBCSI> HAD 4TH QUARTER PROFIT ,GERMAN BOURSE TURNOVER TAX DECISION ANGERS BANKS ,PLESSEY WINS TEN MLN STG PAYPHONE ORDERS ,FED SAYS IT SETS THREEDAY SYSTEM REPURCHASE AGREEMENTS
 ,MIM TO ACQUIRE STAKE IN GERMAN COPPER PRODUCER ,MAGNA ltMAGAF> CREATES NEW COSMA UNIT ,JW MAYS INC ltMAYS> 2ND QTR JAN 31 NET ,CIRCUS CIRCUS ENTERPRISES ltCIR> 4TH QTR NET ,FED ADDS RESERVES VIA THREEDAY REPURCHASES ,NATIONAL FUEL GAS CO ltNFG> SETS MAIL DATE ,COMTECH ltCMTL> TO SELL PREMIER MICROWAVE ,INVESTMENT FIRMS HAVE 59 PCT OF PUROLATOR ltPCC> ,TOFUTTI BRANDS ltTOF> SEES PROFIT FOR NEW YEAR ,DIGITECH INC ltDGTC> 1ST QTR JAN 31 NET ,UNION VOTES TO STRIKE DAKOTA CITY IBP PLANT ,ULTRASYSTEMS ltULS> UNIT GETS DOD CONTRACTS ,BELGIUM REVISES DOWN 1987 GNP GROWTH FORECASTS ,MOLECULON ltMBIO> SEES NEW WAY TO KICK THE HABIT ,RAYTHEON ltRTN> UNIT GETS 337 MLN DLR CONTRACT ,BZW MAKES MARKETS IN JAPAN DOLLAR CONVERTIBLES ,CABOT MEDICAL CORP ltCBOT> 1ST QTR JAN 31 NET ,AMERIHEALTH INC ltAHTH> 4TH QTR LOSS ,BANKS SEE GERMAN GROWTH OF AT LEAST TWO PCT ,CAMBRIDGE ANALYTICAL ltCAAN> SEES FIRST QTR LOSS ,SETON ltSEL> GETS BUYOUT OFFER FROM CHAIRMAN ,MRS FIELDS PLANS TO OPEN MORE STORES ,HITECH ENGINEERING ltTHEX> TO MAKE PROJECTOR ,BRAZIL SAYS DEBT CRISIS IS WORLD PROBLEM ,EASTMAN KODAK ltEK> SETS CHEMICAL VENTURE ,US INDUSTRIAL CAPACITY USE RATE ROSE TO 798 PCT IN FEB FROM 796 PCT IN JAN
 ,BIOTECHNOLOGY DEVELOPMENT ltBIOD> 4TH QTR LOSS ,FRANCES CFF TO ISSUE 500 MLN FRANCS BONDS ,PENN CENTRAL ltPC> CANT EXPLAIN STOCK ACTIVITY ,HECHINGER CO ltHECH> 4TH QTR NET ,METEX ltMTX> CHAIRMAN SELLS SHARES ,CETUS ltCTUS> CANCER DRUG TO GET EUROPE PATENT ,AROUND 35 MLN ACRES SAID TO BE IDLED BY 0/92 ,IFC PLANS TO LEAD THIRD WORLD TO CAPITAL MARKETS ,AMERICAN SECURITY ltASEC> TO RELEASE INFORMATION ,SVENSKA CELLULOSA AB ltSCABST> 1986 YEAR ,COLOMBIA COFFEE EXPORTERS BELIEVE IN PRAGMATISM ,BELGIAN GOVERNMENT TO CUT FINANCIAL REQUIREMENT ,ROYAL TRUST PLOTS AGGRESSIVE GLOBAL EXPANSION ,SALOMON RAISES CATERPILLAR ltCAT> OPINION ,ROCKWOOD HOLDING CO ltRKWD> 4TH QTR NET ,CANADA PRIME MINISTER SAYS A MAJOR TRADE DEAL EMERGING WITH US
 ,FORUM ltFOUR> ENDS BEVERLY ltBEV> PURCHASE DEAL ,FDA EXPERT PANEL VOTES TO RECOMMEND APPROVAL OF UPJOHNS ROGAINE BALDNESS DRUG
 ,UK AIRPORT AUTHORITY TO BE PRIVATISED IN SUMMER ,UK BANKING HEAD RESUMES ATTACK ON CITY PREDATORS ,SOME 7000 MINERS GO ON STRIKE IN SOUTH AFRICA ,CONSUL RESTAURANT ltCNSL> IN EXCHANGE OFFER ,FBX CORP ltFBXC> YEAR NOV 30 NET ,ltHOECHST AG> UNIT TO RAISE 500 MLN DLRS ,US CAPACITY USE RATE 798 PCT IN FEBRUARY ,FDA PANEL BACKS UPJOHN ltUPJ> BALDNESS DRUG ,UNION VOTES TO STRIKE DAKOTA CITY IBP PLANT ,TORONTO SUN EXAMINING POSSIBLE UK TABLOID ,INTEGRATED GENERICS ltIGN> UNIT TO GO PUBLIC , Balladur maintains 1987 25 pct inflation target after February 34 pct yearonyear
 ,CSCE TO PUT ADDITIONAL MARGIN ON JULY COCOA ,ltCOOPER CANADA LTD> YEAR NET ,MEDIA GENERAL ltMEGA> FEBRUARY REVENUES RISE ,TAB PRODUCTS CO ltTBP> 3RD QTR FEB 28 NET ,MARKEL CORP ltMAKL> 4TH QTR NET ,SCIENCE ACCESSORIES CORP ltSEAS> 1ST QTR NET ,WORLDGROUP ltTOURA> SUED BY TRAVEL AGENCIES , French adjusted February trade deficit 400 mln francs vs January deficit 25 billion
 ,BIFFEX MEMBERS TO BALLOT ON MERGER ,MACHINE TECHNOLOGY ltMTEC> SEES 2ND QTR LOSS ,DOCUGRAPHIX INC ltDOCX> 3RD QTR JAN 31 LOSS ,NBD BANCORP ltNBD> REGULAR DIVIDEND SET ,EDWARD HINES LUMBER NET REALIZABLE VALUE SET ,CHEYENNE SOFTWARE ltCHEY> TO ISSUE NEWS RELEASE ,TRIANGLE MICROWAVE ltTRMW> IN TALKS ON BUYOUT ,YEUTTER REPEATS RETALIATION THREAT ON EC OIL TAX ,CANADAS MULRONEY SAYS US TRADE DEAL NEARS ,FRANCE REDUCES TRADE DEFICIT IN FEBRUARY ,NYFE SEAT SELLS FOR 200 DLRS ,NAVISTAR RECALLING 52000 TRUCKS AND BUSES
 ,NCR ltNCR> SEES GOOD CHANCE FOR RECORD YEAR NET ,DESJARDINS GROUP CONSIDERING SHARE OFFERING ,FIAT CONVERTIBLE BOND OPTION UNDER STUDY ,AEROSPATIALE STUDYING HIGHSPEED AIRLINER ,FLOATING RATE NOTE MARKET STILL IN TURMOIL ,EQUITABLE BANC ltEBNC> BOSS HAS AMERITRUST STAKE ,AMERICAN SECURITY ltASEC> BUYOUT COMPLETED ,US COULD COMPLAIN TO GATT ON CANADA CORN DUTY ,CONRAIL SAID INITIAL OFFERING COULD BE MADE NEXT WEEK AT 26 TO 29 DLRS SHARE
 ,RAINIER ltRBAN> COMPLETES ACQUISITION ,NAVISTAR ltNAV> RECALLING 52000 TRUCKS BUSES ,FRANKLIN RESOURCES INC ltBEN> SETS QUARTERLY ,BALLADUR MAINTAINS 1987 FRENCH INFLATION TARGET ,COLOROCS ltCLRX> SIGNS AGREEMENTS WITH SHARP ,GENERAL CINEMA ltGCN> SEES FLAT 1987 NET ,LEVON RESOURCES ltLVNVF> GOLD ASSAYS IMPROVED ,PARIS FUTURES MARKET TO NAME NEW MEMBERS ,ltTEECO PROPERTIES LP> SETS CASH DISTRIBUTION ,ROWNTREE CONVERTIBLE INCREASED TERMS SET ,ltRADIX VENTURES INC> 2ND QTR JAN 31 LOSS ,TRADE SEES STEADY CORN/WHEAT EXPORT INSPECTIONS ,ADOBE SYSTEMS INC ltADBE> 1ST QTR FEB 28 NET ,ARMTEK ltARM> COMPLETES SALE OF ASSETS ,VW FOREIGN EXCHANGE INQUIRIES FOCUS ON WOLFSBURG ,202 DATA SYSTEMS INC ltTOOT> 1ST QTR JAN 31 NET ,GENRAD ltGEN> SHIPS CHIP TEST SYSTEM ,VISHAY ltVSH> SETS TWO PCT STOCK DIVIDEND ,ltONYX PETROLEUM EXPLORATION CO LTD> YEAR LOSS ,HUGHES TOOL ltHT> US RIG COUNT DECLINES ,INTEGRATED CIRCUITS ltICTM> SETS RECORD DATE ,BP ltBP> UNIT SEES MINE PROCEEDING ,NORWAY APPROVES TRADE BAN AGAINST SOUTH AFRICA ,MSA REALTY CORP ltSSS> 4TH QTR NET ,LEAR PETROLEUM PARTNERS LP ltLPP> 4TH QTR LOSS ,WESTRONIC INC ltWSTX> YEAR LOSS ,KENAN TRANSPORT CO ltKTCO> SETS QUARTERLY ,ltRAPHOLZ SILVER INC>TO STUDY MINE WATER PROJECT ,CONRAIL SAYS OFFERING COULD BE MADE NEXT WEEK ,GENCORP 1ST QTR SHR 77 CTS VS 84 CTS
 ,FORLAND ltFORL> IN DRILLING PACT ,WORTHEN BANKING ltWOR> UNIT HEAD QUITS ,ONYX PETROLEUM CONVERTS DEBENTURES TO COMMON ,GOTAASLARSEN ltGOTLF> TO BUILD FIFTH CARRIER ,DANISH CREDIT DOWNGRADING NOT DRAMATIC  MINISTER ,MAGNETIC TECHNOLOGIES CORP ltMTCC> 1ST HALF NET ,GENCORP ltGY> 1ST QTR FEB 28 NET ,MARKEL SUBSIDIARY SETS INITIAL SHARE ISSUE ,BP UNIT SEES US GOLD MINE PROCEEDING ,SAFETYKLEEN ltSK> TO BUY STAKE IN OIL REFINER ,LOBLAW COS TO SELL 75 MLN DLRS OF DEBENTURES ,TRADE INTERESTS READY FOR BATTLE IN US HOUSE ,GOLDEN VALLEY ltGVMF>TO REGISTER SECONDARY OFFER ,MAGNETIC TECHNOLOGIES ltMTCC> SEES IMPROVEMENT ,LEVON RESOURCES REPORTS IMPROVED GOLD ASSAYS ,WELBILT CORP ltWELB> 4TH QTR NET ,SATELLITE MUSIC NETWORK INC ltSMNI> YEAR NET ,STARREX LINKS SHARE PRICE TO ASSAY SPECULATION ,COMBINED INTL TO ASK DOUBLING OF AUTHORIZED SHARES STOCK SPLIT
 ,INTERNATIONAL KINGS ltIKNG> NAMES PRESIDENT ,ETHIOPIA MINISTER SEES AFRICA DEBT PAYMENT PROBLEM ,CANBRA FOODS LTD SETS SPECIAL ONETIME FIVE DLR/COMMON SHR CASH PAYOUT
 ,CANBRA FOODS LTD YEAR OPER SHR PROFIT 152 DLRS VS LOSS 55 CTS
 ,WILSON FOODS CORP ltWILF> 2ND QTR JAN 31 NET ,US TURKEY SIGN AID AGREEMENT ,ltCANBRA FOODS LTD> YEAR NET ,OXFORD FIRST CORP ltOFC> 4TH QTR NET ,NEW SENATOR BACKS US FARM DECOUPLING PROPOSALS ,BHP MINTERALS ltBRKNY> MELDS UTAH INTERNATIONAL ,HARRISTEETER PROPERTIES ltHTP> REPORTS EARNINGS ,COOPER LASER ltZAPS> RESCHEDULES ANNUAL MEETING ,ltKRON CHOCOLATIER INC> TO REDEEM WARRANTS ,BSN CORP ltBSN> 4TH QTR NET ,BSN ltBSN> SEES HIGHER 1987 NET ,SEC OKAYS REQUEST FROM BOESKY FIRMS TO PROTECT FUNDS FROM CLAIMANTS
 ,COMBINED INTL ltPMA> HOLDERS TO VOTE ON SPLIT ,CANBRA FOODS SETS SPECIAL FIVE DLR/SHR PAYOUT ,ATT ltT> MAY FACE STRUGGLE OVER DEREGULATION ,JORDAN OBTAINS 988 MLN DLRS IN LOANS ,SEC OKAYS BOESKY FIRMS MOVE TO PROTECT FUNDS ,INVESTORS SAVINGS ltISLA> CALLS PREFERRED ,ltKENT TOYS INC> IN PACT WITH LORIMAR ltLT> ,ADVANCE CIRCUITS INC ltADVC> 2ND QTR FEB 28 NET ,COMMONWEALTH MORTGAGE ltCMA> SETS PAYOUT ,ltBKLA BANCORP> DEC 31 YEAR NET ,PRECISION TARGET MARKETING ltPTMI> 3RD QTR NET ,CHEYENNE SOFTWARE ltCHEY> IN ACQUISITION TALKS ,HUDSON VALLEY PATROL AGREES TO BUY GUARD FIRM ,ICCO TO EXAMINE BUFFER STOCK PROPOSAL TOMORRROW ,SAUDI BUSINESSMEN SEEK TO BOOST PRIVATE SECTOR ,AMCAST INDUSTRIAL CORP ltACST> 2ND QTR MARCH ONE ,DOW ltDOW> SETS GROUNDWATER POLLUTION VENTURE ,SCIENTIFIC SYSTEMS SERVICES INC ltSSSV> 4TH QTR ,SKIPPERS INC ltSKIP> SEMIANNUAL DIVIDEND ,ZIEGLER CO INC ltZEGL> SETS QUARTERLY ,DIAMONDSTAR MOTORS ADDS MORE SUPPLIERS ,US EXPORT INSPECTIONS IN THOUS BUSHELS  SOYBEANS 18345 WHEAT 11470 CORN 34940
 ,HILTON HOTELS ltHLT> TO LAUNCH NEW PRODUCT ,BANKING CENTER ltTBCX> TO MAKE ACQUISITION ,SAN PAOLO DI TORINO TO ACQUIRE CALIFORNIAN BANK ,USDA DETAILS CONSERVATION CROP ENROLLMENT ,US SENATOR UNCOMMITTED ON OFFERING 0/92 BILL ,NYSE TO REPORT IMBALANCES ON EXPIRATION FRIDAY ,PNC FINANCIAL ltPNCF> UNIT UPGRADED BY MOODYS ,VIDEO SHOPPING MALL EXPANDS VIEWERS BASE ,INTERNATIONAL FINE FOODS MAKES ACQUISITION ,STIFFER US SECURITIES PENALTIES SOUGHT ,UNITED TOTE INC ltTOTE> 1ST QTR JAN 31 NET ,PROMED CAPITAL ltPRMD> TO BE INCLUDED IN NMS ,SYSTEMHOUSE INC ltSHKIF> WINS CONTRACT ,SEVEN OAKS ltQPON> IN TELEMARKETING VENTURE ,BALLY MFG FILES FOR PUBLIC OFFERING OF ITS HEALTH AND TENNIS CORP SUBSIDIARY
 ,CME CBOE TO LAUNCH INTERNATIONAL STOCK INDEX ,WESTERN DIGITAL ltWDC> TO REDEEM CONVERTIBLE DEBT ,QUADREX CORP ltQUAD> 4TH QTR JAN 31 LOSS ,MOODYS MAY DOWNGRADE CONSECO ltCNC> DEBT ,MORGAN ltJPM> SAYS BRAZIL NONACCRUALS MAY RISE ,PHILIP CROSBY ASSOCIATES ltPCA> EARNINGS DELAYED ,BALLY MFG ltBLY> TAKING HEALTH CLUB UNIT PUBLIC ,UNITED TOTE INC ltTOTE> 1ST QTR JAN 31 NET ,PACIFIC RESOURCES ltPRI> INSTALLS OIL MOORING ,US MONEY MANAGERS MAY LEAN TO STOCKS VS BONDS ,NEW PLAN REALTY TRUST ltNPR> 2ND QTR NET ,BELLSOUTH ltBLS> EXPANDS MOBILE PHONE SERVICE ,SCHLUMBERGER SAYS IT TERMINATES PACT TO SELL FAIRCHILD SEMICONDUCTOR BUSINESS TO FUJITSU
 ,MORE CCC CREDIT GUARANTEES FOR ALGERIA  USDA ,PL 480 COMMODITIES FOR HONDURAS  USDA ,US EXPORTERS REPORT 150000 TONNES CORN  SOLD TO UNKNOWN DESTINATIONS FOR 1986/87
 ,NIGERIAN RIOTERS TO FACE SUMMARY TRIAL ,SENS DANFORTH BOND ASK TARGETED 0/92 MEASURE ,CCC ACCEPTS BONUS BID ON BARLEY TO CYRPUS ,LYNCH CORP ltLGL> UNIT BUYS TELEVISION STATION ,MORGAN ltMS> LICENSES OVERSEAS INDEX FOR TRADING ,SCHLUMBERGER ltSLB> ENDS PACT TO SELL FAIRCHILD ,HENLEY GROUP ltHENG> SETS FISHER DISTRIBUTION ,FORD ltF> TO RECALL 33600 FULL SIZE CARS ,OMB CHIEF SAYS CONGRESS CLOSE ON DEFICIT CUTS ,GENCORP ltGY> 1ST QTR OPERATING EARNINGS ROSE ,NEW EEP DURUM WHEAT OFFER TO ALGERIA  USDA ,ADVANCED MICRO ltAMD> PLANS NEW MICROPROCESSOR ,MCCORMICK AND CO INC ltMCCRK> 1ST QTR FEB 28 NET ,LYPHOMED ltLMED> VESTAR ltVSTR> JOINT VENTURE ,TWA SAID IT DOES NOT INTEND TO SEEK CONTROL OF USAIR ACQUIRE MORE STOCK AT THIS TIME
 ,NJ BUSINESS CONVERTS MAGAZINE TO MONTHLY ,TELEQUEST INC ltTELQ> 4TH QTR DEC 31 LOSS ,US EEP VEG OIL PROPOSALS STILL UNDER REVIEW ,IRAN GAIN IN IRAQI TERRITORY SEEN INSIGNIFICANT ,AMCAST INDUSTRIAL CORP ltACST> 2ND QTR NET ,CHICAGO DOCK AND CANAL ltDOCKS> 3RD QTR NET ,MCGRAW HILL ltMHP> BUYS HARPER/ROW ltHPR> UNIT ,INFINITE GRAPHICS ltINFG> SEES HIGHER 4TH QTR ,SUBURBAN BANCORP ltSUBBA> UNIT WINS JUDGMENT ,AFFILIATED PUBLICATIONS INC ltAFP> SETS PAYOUT ,FRANKLIN RESOURCES INC ltBEN> QTLY DIVIDEND ,TWA FILES APPLICATION SEEKING RIGHT TO RAISE USAIR STAKE TO 25 PCT
 ,COOPERVISION HAS 65 PCT OF COOPER LASER ltZAPS> ,MASSACHUSETTS GOV DUKAKIS TO SEEK WHITE HOUSE ,DNA MEDICAL ltDNAM> SIGNS PACT FOR STOCK SALE ,WESTERN DIGITAL ltWDC> TO REDEEM DEBENTURES ,ltCANADIAN ROXY PETROLEUM LTD> YEAR NET ,CITYFED ltCTYF> TO SELL CONSUMER LENDING OFFICES ,TRANS WORLD AIRLINES ltTWA> FILES ON USAIR ltU> ,FIRST BANK ltFBS> AGREES TO SELL ANOTHER BANK ,BANNER "A" STOCK ltBNR> EXCHANGED FOR "B" SHARES ,INVESTOR EYES BETHLEHEM STEEL ltBS> BOARD SEAT ,AMERICAN INTERNATIONAL PETROLEUM TO BUY ASSETS ,DATAPOWER ltDPWRC> FELL BELOW NASD REQUIREMENTS ,THREE D DEPARTMENTS INC ltTDD> 2ND QTR JAN 31 ,ltCONSOLIDATED PIPE LINES CO> YEAR NET ,NEWCOR INC ltNEW> 1ST QTR JAN 31 NET ,SKYLINE CORP ltSKY> 3RD QTR FEB 28 ,AMERICAN LOCKER ltALGI> CONDUCTS TESTS ,TECH DATA CORP ltTECD> 4TH QTR ENDS JAN 31 NET ,SENATE COMMITTEE MAY LOOK AT FUEL TAX PROPOSALS ,BRAZIL TRADE SURPLUS RISES IN FEBRUARY ,FARAH ltFRA> NAMES FINANCIAL OFFICER ,ARMTEK ltARM> UNIT LEVERAGED BUYOUT COMPLETED ,HORIZON BANCORP ltHZB> SETS REGULAR PAYOUT ,ASHLAND OIL CHAIRMAN SEES LOSS FROM OPERATIONS IN THE SECOND FISCAL QUARTER
 ,HENLEY ltHENG> TO ISSUE SUBSIDIARYS SHARES ,SCHLUMBERGER ltSLB> MAY HAVE ALTERNATE BUYER ,VOTRAX INTL ltVOTX> WINS FORD ltF> UNIT CONTRACT ,BRAZILS TRADE SURPLUS DOUBLED IN FEBRUARY ,PENN CENTRAL ltPC> SELLS UK UNIT ,ltSILICON VALLEY BANCSHARES> SETS STOCK PAYOUT ,GENERAL INSTRUMENT ltPSE> GETS AIR FORCE AWARD ,UAW DENIES FORD ltF> SET AS TARGET ,WEST GERMAN PRESIDENT HOLDS TALKS WITH ALFONSIN ,CARL ICAHN SAYS HE IS TARGET OF SEC PROBE OF POSSIBLE EXCHANGE ACT VIOLATIONS
 ,US SELLS 3MO BILLS AT 558 PCT STOP 559 PCT 6MO 558 PCT STOP 559 PCT
 ,ANHEUSERBUSCH ltBUD> SETS HIGHER SPENDING ,DI GIORGIO CORP ltDIG> QTLY DIVIDEND ,SOYBEAN GROUPS MEET WITH LYNG TO DISCUSS LOAN ,LATIN NATIONS SET STRATEGY FOR UNCTAD MEETING ,ROYALE AIRLINES ltRYAL> REPORTS LOAD FACTOR UP ,CONSUL ltCNSL> SEES IMPROVED LIQUIDITY ,US HEATING OIL FUTURES UP SHARPLY IN APRIL ,TRANSAMERICA INCOME ltTAI> MONTHLY DIVIDEND ,MCDERMOTT ltMDR> SAYS STAKE VIOLATES LAW ,HIGH VOLTAGE ltHVE> ADOPTS STOCK OWNERSHIP PLAN ,ICAHN SAYS HE IS TARGET OF SEC INVESTIGATION ,SMITHKLINE ltSKB> AIMS FOR 10 PCT EARNINGS RAISE ,ASHLAND OIL ltASH> SEES 2ND QTR OPER LOSS ,AMERITRUST ltAMTR> SELLS TWO MLN SHARES ,VULCAN PACKAGING ltVIPLF> SETS ISSUER BID ,BANKAMERICA CHAIRMAN SAYS BANK IS TURNING AROUND HEADING TO PROFITABILITY
 ,ltGENERAL LEASEHOLDS LTD> YEAR NET ,BRITISH FARM MINISTER ATTACKS SUBSIDIES ,NEW ENGLAND POWER TO REDEEM PREFERRED SHARES ,BANKAMERICA ltBAC> CHAIR SAYS BANK TURNING AROUND ,ROCHESTER TELEPHONE CORP ltRTC> SETS DIVIDEND ,AUGAT INC ltAUG> SETS QUARTERLY DIVIDEND ,PHH GROUP ltPHH> REGULAR QTLY DIVIDEND ,TELCO SYSTEMS INC ltTELC> 2ND QTR MARCH ONE LOSS ,US DECLINES COMMENT ON SCHLUMBERGERltSLB> MOVE ,PRECISION TARGET MARKETING INC ltPTMI> 3RD QTR ,CONRAIL PUBLIC OFFERING TO BE LARGEST IN US ,ROYAL BANK/CANADA BRAZIL UNIT SEES GROWTH ,WANG WANB SEES GROWTH IN OFFICE AUTOMATION ,AFFILIATED PUBLICATIONS INC ltAFP> SETS DIVIDEND ,BANKAMERICA ltBAC> SAYS IT WILL MAKE DEBT OFFER ,ASTROMED INC ltALOT> 4TH QTR NET ,CENTRAL PENNSYLVANIA ltCPSA> BUYS STAKE IN FIRM ,BANKAMERICA ltBAC> CHIEF SEES BRAZIL SOLUTION ,NZ PORTS REOPEN BUT FURTHER CLOSURES POSSIBLE ,ZIMMER ltZIM> BOOSTS CREDIT LINE BY 43 MLN DLRS ,EXPLOSIVE FABRICATORS ltBOOM> MAKES NASDAQ LIST ,ATCOR ltATCO> SAYS OUTLOOK DEPENDS ON STEEL ,ZZZZ BEST CO INC ltZBST> 3RD QTR NET ,PACIFIC LIGHTING ltPLT> CONSIDERS UNIT SALE ,MLX ltMLXX> UNIT AGREES TO BY ABEX UNIT ,MODULINE INTERNATIONAL ltMDLN> 3RD QTR OPER LOSS ,ltFINANCIAL TRUSTCO CAPITAL LTD> HIKES PAYOUT ,USP REAL ESTATE ltUSPTS> HAS GAIN ON SALE ,BINDLEY WESTERN INDUSTRIES INCltBIND>4TH QTR NET ,TECHNICLONE INTERNATIONAL SETS JOINT VENTURE ,CENTEL ltCNT> SEES LOWER FIRST QTR PROFITS ,FNMA ltFNM> WILL NOT BUY HOMEEQUITY LOANS ,MORGAN STANLEY ltMS> ISSUES MORTGAGE BONDS ,WINGS WEST AIRLINES ltWING> 3RD QTR NET ,TWA ltTWA> SEES BENEFITS IN USAIR ltU> MERGER ,ADOBE ltADB> HIGH PLAINS ltHPOC> TO MERGE ,EC WARNS US AND JAPAN ON TRADE TENSIONS ,NATIONAL HEALTH CARE ltNHCS> NAMES NEW OFFICIALS ,CEASARS WORLD FILES SUIT AGAINST MARTIN SOSNOFF AND MTS ACQUISITION ON TENDER OFFER
 ,COASTAL ltCGP> HIT WITH TWO BILLION DLR LAWSUIT ,CAESARS WORLD ltCAW> FILES SUIT AGAINST SOSNOFF ,HARRIS UPS CENTERRE BANCORP ltCTBC> STAKE ,PAYNSAVE ltPAYN> 1ST QTR JAN 31 NET ,DEBT PROGNOSIS AGREED BUT NO CURE IN SIGHT ,PROPOSED OFFERINGS RECENTLY FILED WITH THE SEC ,EC COMMISSION DEFENDS FARM PROGRAM ,AERO SERVICES ltAEROE> IN PACT FOR NOMINATIONS ,LOS ANGELES SECURITIES ltLSGA> SETS MANAGMENT ,Australia Feb current account deficit 750 mln dlrs vs Jan 123 billion  official
 ,AUSTRALIAN CURRENT ACCOUNT DEFICIT NARROWS IN FEB ,MIYAZAWA SAYS NO INTENTION TO ALTER SALES TAX BILL ,AUSTRALIAN RESERVES FALL IN FEBRUARY ,Japan February wholesale prices fall 01 pct 06 pct January drop  official
 ,JAPAN WHOLESALE PRICES FALL 01 PCT IN FEBRUARY ,MITSUBISHI BANK ltMITBT> PLANS 40 MLN NZ DLR CD ,CREDITORS/DEBTORS SHARE RESPONSIBILITYWEIZSAECKER ,EC AGREES ON AID PACKAGE FOR MEDITERRANEAN STATES ,STRIKES AGAINST WAGE FREEZE SPREAD IN YUGOSLAVIA ,CONSERVATIVES MAKE MAJOR GAINS IN FINNISH POLLS ,POINDEXTER MAY GET IMMUNITY TO HELP TRACK FUNDS ,INDIAN OIL/GAS COMMISSION GETS 265 MLN DLR CREDIT ,TOYOTA SEEN GETTING MANILA APPROVAL FOR CAR OUTPUT ,DOLLAR SEEN FALLING UNLESS JAPAN SPURS ECONOMY ,MARKET WELCOMES LOWER AUSTRALIAN PAYMENTS DEFICIT ,HONGKONG BANK SAYS CLOSE TO DEAL ON PROPERTY SALE ,CHINA IMPOSES QUOTAS TO CUT LOSS OF FARMLAND ,THAI M1 MONEY SUPPLY RISES IN JANUARY ,JAPAN TO RELEASE GNP FIGURES LATER TODAY ,CONTRAS CARRY OUT FIRST RAID IN NICARAGUAN CAPITAL ,TAIWAN 1986 BALANCE OF PAYMENTS SURPLUS IS RECORD ,EC WARNS US AND JAPAN ON TRADE TENSIONS ,CATHAY PACIFIC 1986 PROFIT SEEN ABOVE TARGET ,RENISON GOLDFIELDS EXTENDS LYELL COPPER MINE LIFE ,NEW ZEALAND PRESS GROUP BUYS MORE TEXAS NEWSPAPERS ,INDIA PREPARES TO LAUNCH INTERCONTINENTAL ROCKET ,US AGRICULTURE SECRETARY WARNS EC ON SOY OIL TAX ,KOBE RUBBER EXCHANGE TO EXTEND TRADING HOURS ,COASTAL ltCGP> SEEKS TO HALT BILLION DLR LAWSUIT ,INDIAN THERMAL POWER FIRM GETS 169 MLN MARK CREDIT ,TOKYO STOCK MARKET AVERAGE RISES 9936 TO RECORD CLOSING HIGH OF 2151473
 ,STUDY PREDICTS US DEPENDENCE ON FOREIGN OIL ,JAPAN M2 PLUS CD MONEY SUPPLY ROSE 88 PCT IN YEAR TO FEBRUARY JAN 86  OFFICIAL
 ,JAPAN FEBRUARY MONEY SUPPLY RISES 88 PCT ,MALAYSIA PLANS 16 BILLION RINGGIT LOAN ISSUE ,CHINA TO IMPORT MORE GRAIN IN 1987 ,SOUTH KOREA PREMIER OFFERS TALKS WITH NORTH KOREA ,SYRIA PROPOSES REDUCED BUDGET FOR 1987 ,Japan October/December GNP up 08 pct July/Sept revised 07 rise  official
 ,Japan GNP rises 25 pct in calendar 1986 47 pct in 1985  official
 ,JAPAN OCTOBER/DECEMBER GNP RISES 08 PCT ,COMMONWEALTH BANK PLANS 500 MLN DLR PAPER FACILITY ,JAPAN OFFICIALS SEE DIFFICULTY HITTING GNP TARGET ,FAIRCHILD DEAL FAILURE SEEN MAKING JAPANESE WARY ,BANK OF JAPAN TO SELL 300 BILLION YEN IN BILLS ,SKOREA SAYS JAPAN COMPLAINS TO GATT ON TRADE PLAN ,AUSTRALIAN CURRENCY TRADING SET RECORD IN JANUARY ,JAPAN SEEN REDUCING BEEF PORK INTERVENTION PRICES ,SMH ISSUES 100 MLN SWISS FRANC BOND WITH WARRANTS , Danish central bank cuts overnight money market interest rate to 105 pct from 11 pct  official
 ,MITSUBISHI CHEMICAL INDUSTRIES LTD ltMCITT> YEAR ,BELGIAN STATE LOAN PRICED AT PAR ,TAIWAN CABINET APPROVES RECORD DEFICIT BUDGET ,JAPAN FOREIGN SHIPBUILDING ORDERS RISE IN FEBRUARY ,UK MONEY MARKET DEFICIT FORECAST AT 450 MLN STG ,MERITOR SAVINGS BANK LAUNCHES 200 MLN DLR BOND ,JAPAN LINE FLOATS STOCK TO HELP RESTORE SOLVENCY ,CCIC FINANCE LTD  YEAR TO DEC 31 ,SWEDISH EXPORT CREDIT LAUNCHES AUSTRALIAN DLR BOND ,GMAC CANADA UNIT ISSUES CANADIAN DOLLAR BOND ,HONDA SHIFTS SOME MOTORCYCLE PRODUCTION TO US ,SOUTHEAST CHINA CROPS SAVED BY HEAVY RAIN ,ZAMBIA STOPS SENDING COPPER THROUGH SOUTH AFRICA ,JAPAN FIRMS SEEK OIL EQUIPMENT DEAL WITH HUNGARY ,NISSHO IWAI PROPOSES WESTINGHOUSE FOR AIRPORT ,OECD JANUARY ANNUAL INFLATION STEADY AT 21 PCT ,TORONTO DOMINION ISSUES 20 BILLION YEN EUROBOND ,SINGAPORE ENDS SCHEME TO HELP BROKING FIRMS ,CARGILL STRIKE TALKS CONTINUING TODAY ,SPAINS FECSA SUSPENDS PRINCIPAL REPAYMENTS ,INDONESIAN SUGAR OUTPUT FORECAST TO RISE IN 1987 ,TAIWAN ISSUES MORE CERTIFICATES OF DEPOSIT ,EIB LOANS TO ITALY FOR INDUSTRY AND TRANSPORT ,FRENCH JANUARY PAYMENTS SURPLUS 03 BILLION FRANCS 38 BILLION DECEMBER SURPLUSOFFICIAL
 ,ITALIAN WHOLESALE PRICES UP 11 PCT IN JANUARY ,CEREAL TRADERS SEEK TALKS WITH ANDRIESSEN ON EMS ,TAIWAN SAID CONSIDERING CURRENCY LIBERALISATION ,FRENCH PAYMENTS SURPLUS SHRINKS IN JANUARY ,KOBEYA BAKING HAS SWISS FRANC PRIVATE PLACEMENT ,UK FEB PSBR REPAYMENT 300 MLN STG 11 MONTH REQUIREMENT 100 MLN  OFFICIAL
 ,UK JAN INDUSTRIAL OUTPUT RISES 04 PCT MANUFACTURING DOWN 23 PCT  OFFICIAL
 ,UK FEBRUARY PSBR REPAYMENT 300 MLN STG ,ZIMBABWE MAIZE OUTPUT TO FALL 65 PCT ,UK INDUSTRIAL OUTPUT RISES IN JANUARY ,ZIMBABWE GDP RISES 02 PCT IN 1986 ,JAPAN SAYS USJAPAN MICROCHIP PACT WORKING ,ECONOMIC SPOTLIGHT  SAUDI CORPORATE DEBT ,LOOPHOLE FOR TANKERS IN NORWAYS S AFRICA BAN ,BANK OF JAPAN TO SELL 300 BILLION YEN IN BILLS ,HANSON SELLS FINLAYS UNIT FOR 169 MLN STG ,GMAC CANADA UNIT ISSUES CANADIAN DOLLAR BOND ,TORONTO DOMINION ISSUES 20 BILLION YEN EUROBOND ,STRIKES AGAINST WAGE FREEZE SPREAD IN YUGOSLAVIA ,DOLLAR SEEN FALLING UNLESS JAPAN SPURS ECONOMY ,ORION ROYAL WITHDRAWS FROM FRN MARKET ,WORLD BANK EXPECTED TO APPROVE PHILIPPINES LOAN ,UK MONEY MARKET RECEIVES NO MORNING ASSISTANCE ,MIYAZAWA SAYS NO INTENTION TO ALTER SALES TAX BILL ,CONTRAS CARRY OUT FIRST RAID IN NICARAGUAN CAPITAL ,CREDITORS/DEBTORS SHARE RESPONSIBILITYWEIZSAECKER ,SWEDEN RECHECKS JANUARY INFLATION RATE ,IRAN SAID TO ATTACK CYPRIOT TANKER ,EUROPEAN SUPERCHIP PRODUCTION COULD START IN 1988 ,BILLITON SEEKS CHANGE IN SURINAM POLICIES ,US CREDIT MARKET OUTLOOK  HOUSING STARTS ,DUTCH PORT EMPLOYERS RESUME LAYOFF PLANS ,POINDEXTER MAY GET IMMUNITY TO HELP TRACK FUNDS ,WESTERN HEALTH ltWHP> PRESIDENT RESIGNS ,COMMERCIAL INTERNATIONAL ltCMMC> MAKES PURCHASE ,AMEX CHANGED STOP/STOP LIMIT ORDER POLICY ,ltTIMEX CORP> SELLS UNIT ,ltWAVEHILL INTERNATIONAL INC> MAKES PURCHSE ,TRANSNET ltTRNT> TO SERVICE LEADING EDGE PRODUCTS ,IDENTIX ltIDXX> GETS BANKAMERICA ltBAC> ORDER ,ECONOMISTS SEE SLUGGISH JAPANESE ECONOMY AHEAD ,COCOA WORKING GROUP MEETING DELAYED ,SEVEN KILLED IN BLACK SOUTH AFRICAN TOWNSHIP ,FINANCIAL TIMES ADDS NEW INDICES ,US FEB HOUSING STARTS ROSE 26 PCT TO 1851 MLN PERMITS ROSE 44 PCT TO 1764 MLN
 ,BOISE CASCADE ltBCC> TO REDEEM PREFERRED STOCK ,UK BUDGET HOPES BOOSTED BY PSBR DATA  ANALYSTS ,US HOUSING STARTS ROSE 26 PCT IN FEBRUARY ,SOUTH AMERICAN FISH MEAL PRODUCTION AT RECORD HIGH ,TALKING POINT/COPPER STOCKS ,KOHLBERG KRAVIS HAS 96 PCT OWENSILLINOIS ltOI> ,ABM GOLD FILES FOR INITIAL OFFERING ,ECONOMIC SPOTLIGHT  US BANKING REGULATION ,GUYANA PRESIDENT CALLS POISON SCARE "MISCHIEVOUS" ,ADMAR GROUP ltADMR> OPENING NEW OFFICE ,MACGREGOR SPORTING GOODS INC ltMGS>2ND QTR JAN 31 ,EC WARNS US AND JAPAN ON TRADE TENSIONS ,RENEWED BULL SPREADING LIKELY ON CATTLE REPORT ,TANDEM ltTNDM> APPLIES FOR NYSE LISTING ,MICROBILT CORP ltBILT> 4TH QTR JAN 31 NET ,SHAMROCK HOLDINGS UNIT AQUIRES SOFTWARE COMPANY ,CREDIT AGRICOLE REPLACES BNP IN HACHETTE TV BID ,PAYLESS CASHWAYS INC ltPCI> 1ST QTR FEB 28 NET ,FRANCE APPROVES WATERMAN ACQUISITION BY GILLETTE ,GENETICS INSTITUTE ltGENI> BUYS PLANT ,AIRBORNE FREIGHT ltABF> GETS IBM ltIBM> CONTRACT ,UK MONEY MARKET SHORTAGE FORECAST REVISED DOWN ,NOEL INDUSTRIES INC ltNOL> 1ST QTR JAN 31 LOSS ,LUFTHANSA SETS WASHINGTON/FRANKFURT SERVICE ,JAPAN ALERTS GATT TO SOUTH KOREA IMPORT PLAN ,UK MONEY MARKET RECEIVES 16 MLN STG ASSISTANCE ,ATICO FINANCIAL ltATFC> TO MAKE ACQUISITION ,CLOTHESTIME INC ltCTME> 4TH QTR NET ,CHARTERCRELLIN INC ltCRTR> YEAR NET ,ltSENSORMATIC CANADA LTD> YEAR NET ,DIME SAVINGS BANK OF WALLINGFORD ltDIBK> PAYOUT ,BAKER INTERNATIONAL TO SELL ELECTRIC SUBMERSIBLE OILWELL PUMP UNIT
 ,KAYABA INDUSTRY ISSUES 50 MLN SWISS FRANC NOTES ,LUFTHANSA SAYS FARE POLICY IN LINE WITH EC RULES ,SWISSAIR JANUARY TRAFFIC UP REVENUE DOWN ,BAKER ltBKO> TO SELL OILWELL PUMP UNIT ,NO MAJOR FARM POLICY CHANGES THIS YEAR  DOLE ,AMERICAN CITY BUSINESS JOURNALS SHIFTS OFFICERS ,ltCANADIAN FOREMOST LTD> YEAR NET ,SUNGARD DATA ltSNDT> SHARE OFFERING STARTS ,C ITOH UNIT SETS BUYER FINANCING PROGRAM ,IMMUNOGENETICS INC ltIGEN> YEAR NET ,ltSCURRYRAINBOW OIL LTD> 1ST QTR DEC 31 NET ,EIB ISSUES 400 MLN MARK EUROBOND ,HOG AND CATTLE SLAUGHTER GUESSTIMATES ,DANISH CREDIT DOWNGRADING UNIMPORTANT  PREMIER ,MCRAE INDUSTRIES INC ltMRIB> 2ND QTR JAN 31 NET ,ltFRONTIER TEXAS CORP> 2ND QTR NOV 30 NET ,ltVICEROY RESOURCE CORP> DETAILS GOLD ASSAYS ,TAIWAN TO TENDER FOR 450000 TONNES US CORN ,CLABIR ltCLG> UNIT AGRES TO BUY POPSICLE CANADA ,ST JUDE MEDICAL ltSTJM> VOTES DIVIDEND RIGHTS ,NUMAC OIL ltNMC> HAS 597 MLN DLR FINANCING ,ADAMSRUSSELL ELECTRONICS ltAARE> IN PURCHASE ,MESA LIMITED PARTNERSHIP ltMLP> SETS PAYOUT ,US CURRENT ACCOUNT DEFICIT RECORD 3684 BILLION DLRS IN 4TH QTR 1986
